--- Итог сессии ---
Доход: 3956654
Расход: 2560000
Прибыль: 1396654
куртка наемника (мастер) x0 | Продажа: 30594 | Прибыль за шт: -5624.264999999999
куртка наемника (мастер) x8 | Продажа: 404741 | Прибыль за шт: -5625.159999999996
капюшон наемника (эксперт) x14 | Продажа: 115894 | Прибыль за шт: 66.31500000000051
колпак клирика (эксперт) x18 | Продажа: 127909 | Прибыль за шт: -287.0199999999995
колпак ученого (знаток) x6 | Продажа: 13022 | Прибыль за шт: -263.69500000000016
броня солдата (эксперт) x12 | Продажа: 157905 | Прибыль за шт: -1197.8150000000005
колпак ученого (мастер) x1 | Продажа: 21611 | Прибыль за шт: -2768.4500000000007
броня рыцаря (эксперт) x1 | Продажа: 12528 | Прибыль за шт: -1299.7849999999999
куртка наемника (эксперт) x10 | Продажа: 143327 | Прибыль за шт: -1055.795
куртка охотника (эксперт) x9 | Продажа: 138259 | Прибыль за шт: -1852.289999999999
броня солдата (эксперт) x1 | Продажа: 13257 | Прибыль за шт: -1102.0499999999993
колпак клирика (мастер) x6 | Продажа: 136857 | Прибыль за шт: -1893.2649999999994
колпак чародея (мастер) x9 | Продажа: 202661 | Прибыль за шт: -2431.9799999999996
капюшон наемника (эксперт) x1 | Продажа: 14495 | Прибыль за шт: 66.31500000000051
колпак ученого (знаток) x10 | Продажа: 21703 | Прибыль за шт: -264.59000000000015
колпак клирика (эксперт) x17 | Продажа: 120803 | Прибыль за шт: -287.0199999999995
колпак клирика (мастер) x8 | Продажа: 180224 | Прибыль за шт: -2167.1349999999984
капюшон наемника (знаток) x11 | Продажа: 35369 | Прибыль за шт: -332.9749999999999
капюшон убийцы (эксперт) x16 | Продажа: 127711 | Прибыль за шт: -889.9799999999996
шлем хранителя (знаток) x40 | Продажа: 85897 | Прибыль за шт: -246.3699999999999
шлем солдата (знаток) x8 | Продажа: 17561 | Прибыль за шт: -249.52999999999975
капюшон убийцы (эксперт) x4 | Продажа: 35873 | Прибыль за шт: -890.875
куртка наемника (эксперт) x12 | Продажа: 171981 | Прибыль за шт: -1056.6900000000005
броня рыцаря (эксперт) x11 | Продажа: 137794 | Прибыль за шт: -1300.6800000000003
колпак клирика (знаток) x0 | Продажа: 1264 | Прибыль за шт: 908.6399999999999
капюшон убийцы (эксперт) x5 | Продажа: 39910 | Прибыль за шт: -889.9799999999996
сандалии чародея (знаток) x22 | Продажа: 66650 | Прибыль за шт: 152.23500000000013
шлем солдата (знаток) x8 | Продажа: 17561 | Прибыль за шт: -249.52999999999975
колпак клирика (знаток) x6 | Продажа: 14507 | Прибыль за шт: 905.06
куртка наемника (эксперт) x11 | Продажа: 157649 | Прибыль за шт: -1057.5849999999991
куртка охотника (эксперт) x7 | Продажа: 107535 | Прибыль за шт: -1852.289999999999
колпак ученого (мастер) x2 | Продажа: 43179 | Прибыль за шт: -2789.035
колпак ученого (мастер) x8 | Продажа: 171701 | Прибыль за шт: -2912.5449999999983
шлем хранителя (знаток) x5 | Продажа: 11012 | Прибыль за шт: -247.26499999999987
шлем солдата (знаток) x23 | Продажа: 50488 | Прибыль за шт: -250.42500000000018
колпак чародея (старейшина) x1 | Продажа: 146276 | Прибыль за шт: -17646.579999999987
колпак чародея (мастер) x2 | Продажа: 45038 | Прибыль за шт: -2431.084999999999
шлем рыцаря (знаток) x20 | Продажа: 47730 | Прибыль за шт: -266.3699999999999
шлем рыцаря (знаток) x16 | Продажа: 37209 | Прибыль за шт: -269.05499999999984
колпак чародея (мастер) x5 | Продажа: 110386 | Прибыль за шт: -2860.6850000000013
капюшон наемника (знаток) x5 | Продажа: 16091 | Прибыль за шт: -330.28999999999996
шлем хранителя (знаток) x8 | Продажа: 17620 | Прибыль за шт: -246.3699999999999
колпак клирика (мастер) x3 | Продажа: 67584 | Прибыль за шт: -2168.029999999999
колпак ученого (знаток) x10 | Продажа: 21703 | Прибыль за шт: -264.59000000000015
колпак ученого (знаток) x2 | Продажа: 4388 | Прибыль за шт: -240.42500000000018
броня солдата (эксперт) x13 | Продажа: 171064 | Прибыль за шт: -1198.7099999999991
броня солдата (знаток) x2 | Продажа: 9384 | Прибыль за шт: 1599.5
броня рыцаря (эксперт) x9 | Продажа: 112749 | Прибыль за шт: -1300.6800000000003

--- Полный лог сессии ---
[16:07:10] === Начинается сессия продаж ===
[16:07:10] [DEBUG] Проверка существования purchase_log.csv по пути c:\Users\Student\Documents\GitHub\albion_market_main\purchase_log.csv
[16:07:10] [DEBUG] Загружено 19 строк из purchase_log.csv
[16:07:10] [DEBUG] Журнал покупок успешно обработан, 19 уникальных предметов
[16:07:11] [DEBUG] Загружено 391 строк из table.xlsx
[16:07:11] [DEBUG] Колонки table.xlsx: ['name', 'value', 'tir', 'store', 'present']
[16:07:11] [DEBUG] OCR распознал предмет: 'куртка наемника (мастер)'
[16:07:11] [DEBUG] Найдено 0 в purchase_log, 1 в table.xlsx
[16:07:11] [DEBUG] куртка наемника (мастер) не найден в purchase_log, используем table.xlsx
[16:07:11] [DEBUG] Кликаем sell_button для куртка наемника (мастер)
[16:07:11] [DEBUG] Кликаем minus_button для куртка наемника (мастер)
[16:07:12] [DEBUG] Распознана цена продажи: 30594
[16:07:13] [DEBUG] Распознана цена продажи за предмет: 54993
[16:07:13] [DEBUG] Количество предметов в стеке: 0
[16:07:13] [DEBUG] Профит за 1 предмет: -5624.264999999999
[16:07:13] [DEBUG] Кликаем confirm_button для куртка наемника (мастер)
[16:07:13] [DEBUG] Продажа подтверждена: доход=30594, прибыль за шт=-5624.264999999999
[16:07:13] [DEBUG] Итерация завершена, failure_counter=0
[16:07:13] [DEBUG] OCR распознал предмет: 'куртка наемника (мастер)'
[16:07:13] [DEBUG] Найдено 0 в purchase_log, 1 в table.xlsx
[16:07:13] [DEBUG] куртка наемника (мастер) не найден в purchase_log, используем table.xlsx
[16:07:13] [DEBUG] Кликаем sell_button для куртка наемника (мастер)
[16:07:14] [DEBUG] Кликаем minus_button для куртка наемника (мастер)
[16:07:15] [DEBUG] Распознана цена продажи: 404741
[16:07:15] [DEBUG] Распознана цена продажи за предмет: 54992
[16:07:15] [DEBUG] Количество предметов в стеке: 8
[16:07:15] [DEBUG] Профит за 1 предмет: -5625.159999999996
[16:07:15] [DEBUG] Кликаем confirm_button для куртка наемника (мастер)
[16:07:15] [DEBUG] Продажа подтверждена: доход=435335, прибыль за шт=-5625.159999999996
[16:07:15] [DEBUG] Итерация завершена, failure_counter=0
[16:07:16] [DEBUG] OCR распознал предмет: 'капюшон наемника (эксперт)'
[16:07:16] [DEBUG] Найдено 0 в purchase_log, 1 в table.xlsx
[16:07:16] [DEBUG] капюшон наемника (эксперт) не найден в purchase_log, используем table.xlsx
[16:07:16] [DEBUG] Кликаем sell_button для капюшон наемника (эксперт)
[16:07:16] [DEBUG] Кликаем minus_button для капюшон наемника (эксперт)
[16:07:17] [DEBUG] Распознана цена продажи: 115894
[16:07:18] [DEBUG] Распознана цена продажи за предмет: 8997
[16:07:18] [DEBUG] Количество предметов в стеке: 14
[16:07:18] [DEBUG] Профит за 1 предмет: 66.31500000000051
[16:07:18] [DEBUG] Кликаем confirm_button для капюшон наемника (эксперт)
[16:07:18] [DEBUG] Продажа подтверждена: доход=551229, прибыль за шт=66.31500000000051
[16:07:18] [DEBUG] Итерация завершена, failure_counter=0
[16:07:18] [DEBUG] OCR распознал предмет: 'колпак клирика (эксперт)'
[16:07:18] [DEBUG] Найдено 0 в purchase_log, 1 в table.xlsx
[16:07:18] [DEBUG] колпак клирика (эксперт) не найден в purchase_log, используем table.xlsx
[16:07:18] [DEBUG] Кликаем sell_button для колпак клирика (эксперт)
[16:07:19] [DEBUG] Кликаем minus_button для колпак клирика (эксперт)
[16:07:20] [DEBUG] Распознана цена продажи: 127909
[16:07:20] [DEBUG] Распознана цена продажи за предмет: 7724
[16:07:20] [DEBUG] Количество предметов в стеке: 18
[16:07:20] [DEBUG] Профит за 1 предмет: -287.0199999999995
[16:07:21] [DEBUG] Кликаем confirm_button для колпак клирика (эксперт)
[16:07:21] [DEBUG] Продажа подтверждена: доход=679138, прибыль за шт=-287.0199999999995
[16:07:21] [DEBUG] Итерация завершена, failure_counter=0
[16:07:21] [DEBUG] OCR распознал предмет: 'колпак ученого (знаток)'
[16:07:21] [DEBUG] Найдено 0 в purchase_log, 1 в table.xlsx
[16:07:21] [DEBUG] колпак ученого (знаток) не найден в purchase_log, используем table.xlsx
[16:07:21] [DEBUG] Кликаем sell_button для колпак ученого (знаток)
[16:07:21] [DEBUG] Кликаем minus_button для колпак ученого (знаток)
[16:07:22] [DEBUG] Распознана цена продажи: 13022
[16:07:23] [DEBUG] Распознана цена продажи за предмет: 2359
[16:07:23] [DEBUG] Количество предметов в стеке: 6
[16:07:23] [DEBUG] Профит за 1 предмет: -263.69500000000016
[16:07:23] [DEBUG] Кликаем confirm_button для колпак ученого (знаток)
[16:07:23] [DEBUG] Продажа подтверждена: доход=692160, прибыль за шт=-263.69500000000016
[16:07:23] [DEBUG] Итерация завершена, failure_counter=0
[16:07:23] [DEBUG] OCR распознал предмет: 'броня солдата (эксперт)'
[16:07:23] [DEBUG] Найдено 0 в purchase_log, 1 в table.xlsx
[16:07:23] [DEBUG] броня солдата (эксперт) не найден в purchase_log, используем table.xlsx
[16:07:24] [DEBUG] Кликаем sell_button для броня солдата (эксперт)
[16:07:24] [DEBUG] Кликаем minus_button для броня солдата (эксперт)
[16:07:25] [DEBUG] Распознана цена продажи: 157905
[16:07:26] [DEBUG] Распознана цена продажи за предмет: 14303
[16:07:26] [DEBUG] Количество предметов в стеке: 12
[16:07:26] [DEBUG] Профит за 1 предмет: -1197.8150000000005
[16:07:26] [DEBUG] Кликаем confirm_button для броня солдата (эксперт)
[16:07:26] [DEBUG] Продажа подтверждена: доход=850065, прибыль за шт=-1197.8150000000005
[16:07:26] [DEBUG] Итерация завершена, failure_counter=0
[16:07:26] [DEBUG] OCR распознал предмет: 'колпак ученого (мастер)'
[16:07:26] [DEBUG] Найдено 0 в purchase_log, 1 в table.xlsx
[16:07:26] [DEBUG] колпак ученого (мастер) не найден в purchase_log, используем table.xlsx
[16:07:26] [DEBUG] Кликаем sell_button для колпак ученого (мастер)
[16:07:27] [DEBUG] Кликаем minus_button для колпак ученого (мастер)
[16:07:27] [DEBUG] Распознана цена продажи: 21611
[16:07:28] [DEBUG] Распознана цена продажи за предмет: 23490
[16:07:28] [DEBUG] Количество предметов в стеке: 1
[16:07:28] [DEBUG] Профит за 1 предмет: -2768.4500000000007
[16:07:28] [DEBUG] Кликаем confirm_button для колпак ученого (мастер)
[16:07:28] [DEBUG] Продажа подтверждена: доход=871676, прибыль за шт=-2768.4500000000007
[16:07:28] [DEBUG] Итерация завершена, failure_counter=0
[16:07:29] [DEBUG] OCR распознал предмет: 'броня рыцаря (эксперт)'
[16:07:29] [DEBUG] Найдено 0 в purchase_log, 1 в table.xlsx
[16:07:29] [DEBUG] броня рыцаря (эксперт) не найден в purchase_log, используем table.xlsx
[16:07:29] [DEBUG] Кликаем sell_button для броня рыцаря (эксперт)
[16:07:29] [DEBUG] Кликаем minus_button для броня рыцаря (эксперт)
[16:07:30] [DEBUG] Распознана цена продажи: 12528
[16:07:30] [DEBUG] Распознана цена продажи за предмет: 13617
[16:07:30] [DEBUG] Количество предметов в стеке: 1
[16:07:30] [DEBUG] Профит за 1 предмет: -1299.7849999999999
[16:07:31] [DEBUG] Кликаем confirm_button для броня рыцаря (эксперт)
[16:07:31] [DEBUG] Продажа подтверждена: доход=884204, прибыль за шт=-1299.7849999999999
[16:07:31] [DEBUG] Итерация завершена, failure_counter=0
[16:07:31] [DEBUG] OCR распознал предмет: 'куртка наемника (эксперт)'
[16:07:31] [DEBUG] Найдено 0 в purchase_log, 1 в table.xlsx
[16:07:31] [DEBUG] куртка наемника (эксперт) не найден в purchase_log, используем table.xlsx
[16:07:31] [DEBUG] Кликаем sell_button для куртка наемника (эксперт)
[16:07:32] [DEBUG] Кликаем minus_button для куртка наемника (эксперт)
[16:07:32] [DEBUG] Распознана цена продажи: 143327
[16:07:33] [DEBUG] Распознана цена продажи за предмет: 15579
[16:07:33] [DEBUG] Количество предметов в стеке: 10
[16:07:33] [DEBUG] Профит за 1 предмет: -1055.795
[16:07:33] [DEBUG] Кликаем confirm_button для куртка наемника (эксперт)
[16:07:33] [DEBUG] Продажа подтверждена: доход=1027531, прибыль за шт=-1055.795
[16:07:33] [DEBUG] Итерация завершена, failure_counter=0
[16:07:34] [DEBUG] OCR распознал предмет: 'куртка охотника (эксперт)'
[16:07:34] [DEBUG] Найдено 0 в purchase_log, 1 в table.xlsx
[16:07:34] [DEBUG] куртка охотника (эксперт) не найден в purchase_log, используем table.xlsx
[16:07:34] [DEBUG] Кликаем sell_button для куртка охотника (эксперт)
[16:07:34] [DEBUG] Кликаем minus_button для куртка охотника (эксперт)
[16:07:35] [DEBUG] Распознана цена продажи: 138259
[16:07:35] [DEBUG] Распознана цена продажи за предмет: 16698
[16:07:35] [DEBUG] Количество предметов в стеке: 9
[16:07:35] [DEBUG] Профит за 1 предмет: -1852.289999999999
[16:07:36] [DEBUG] Кликаем confirm_button для куртка охотника (эксперт)
[16:07:36] [DEBUG] Продажа подтверждена: доход=1165790, прибыль за шт=-1852.289999999999
[16:07:36] [DEBUG] Итерация завершена, failure_counter=0
[16:07:36] [DEBUG] OCR распознал предмет: 'броня солдата (эксперт)'
[16:07:36] [DEBUG] Найдено 0 в purchase_log, 1 в table.xlsx
[16:07:36] [DEBUG] броня солдата (эксперт) не найден в purchase_log, используем table.xlsx
[16:07:36] [DEBUG] Кликаем sell_button для броня солдата (эксперт)
[16:07:37] [DEBUG] Кликаем minus_button для броня солдата (эксперт)
[16:07:37] [DEBUG] Распознана цена продажи: 13257
[16:07:38] [DEBUG] Распознана цена продажи за предмет: 14410
[16:07:38] [DEBUG] Количество предметов в стеке: 1
[16:07:38] [DEBUG] Профит за 1 предмет: -1102.0499999999993
[16:07:38] [DEBUG] Кликаем confirm_button для броня солдата (эксперт)
[16:07:38] [DEBUG] Продажа подтверждена: доход=1179047, прибыль за шт=-1102.0499999999993
[16:07:38] [DEBUG] Итерация завершена, failure_counter=0
[16:07:39] [DEBUG] OCR распознал предмет: 'колпак клирика (мастер)'
[16:07:39] [DEBUG] Найдено 0 в purchase_log, 1 в table.xlsx
[16:07:39] [DEBUG] колпак клирика (мастер) не найден в purchase_log, используем table.xlsx
[16:07:39] [DEBUG] Кликаем sell_button для колпак клирика (мастер)
[16:07:39] [DEBUG] Кликаем minus_button для колпак клирика (мастер)
[16:07:40] [DEBUG] Распознана цена продажи: 136857
[16:07:41] [DEBUG] Распознана цена продажи за предмет: 24793
[16:07:41] [DEBUG] Количество предметов в стеке: 6
[16:07:41] [DEBUG] Профит за 1 предмет: -1893.2649999999994
[16:07:41] [DEBUG] Кликаем confirm_button для колпак клирика (мастер)
[16:07:41] [DEBUG] Продажа подтверждена: доход=1315904, прибыль за шт=-1893.2649999999994
[16:07:41] [DEBUG] Итерация завершена, failure_counter=0
[16:07:41] [DEBUG] OCR распознал предмет: 'колпак чародея (мастер)'
[16:07:41] [DEBUG] Найдено 0 в purchase_log, 1 в table.xlsx
[16:07:41] [DEBUG] колпак чародея (мастер) не найден в purchase_log, используем table.xlsx
[16:07:41] [DEBUG] Кликаем sell_button для колпак чародея (мастер)
[16:07:42] [DEBUG] Кликаем minus_button для колпак чародея (мастер)
[16:07:42] [DEBUG] Распознана цена продажи: 202661
[16:07:43] [DEBUG] Распознана цена продажи за предмет: 24476
[16:07:43] [DEBUG] Количество предметов в стеке: 9
[16:07:43] [DEBUG] Профит за 1 предмет: -2431.9799999999996
[16:07:43] [DEBUG] Кликаем confirm_button для колпак чародея (мастер)
[16:07:43] [DEBUG] Продажа подтверждена: доход=1518565, прибыль за шт=-2431.9799999999996
[16:07:43] [DEBUG] Итерация завершена, failure_counter=0
[16:07:44] [DEBUG] OCR распознал предмет: 'капюшон наемника (эксперт)'
[16:07:44] [DEBUG] Найдено 0 в purchase_log, 1 в table.xlsx
[16:07:44] [DEBUG] капюшон наемника (эксперт) не найден в purchase_log, используем table.xlsx
[16:07:44] [DEBUG] Кликаем sell_button для капюшон наемника (эксперт)
[16:07:44] [DEBUG] Кликаем minus_button для капюшон наемника (эксперт)
[16:07:45] [DEBUG] Распознана цена продажи: 14495
[16:07:46] [DEBUG] Распознана цена продажи за предмет: 8997
[16:07:46] [DEBUG] Количество предметов в стеке: 1
[16:07:46] [DEBUG] Профит за 1 предмет: 66.31500000000051
[16:07:46] [DEBUG] Кликаем confirm_button для капюшон наемника (эксперт)
[16:07:46] [DEBUG] Продажа подтверждена: доход=1533060, прибыль за шт=66.31500000000051
[16:07:46] [DEBUG] Итерация завершена, failure_counter=0
[16:07:46] [DEBUG] OCR распознал предмет: 'колпак ученого (знаток)'
[16:07:46] [DEBUG] Найдено 0 в purchase_log, 1 в table.xlsx
[16:07:46] [DEBUG] колпак ученого (знаток) не найден в purchase_log, используем table.xlsx
[16:07:47] [DEBUG] Кликаем sell_button для колпак ученого (знаток)
[16:07:47] [DEBUG] Кликаем minus_button для колпак ученого (знаток)
[16:07:48] [DEBUG] Распознана цена продажи: 21703
[16:07:48] [DEBUG] Распознана цена продажи за предмет: 2358
[16:07:48] [DEBUG] Количество предметов в стеке: 10
[16:07:48] [DEBUG] Профит за 1 предмет: -264.59000000000015
[16:07:48] [DEBUG] Кликаем confirm_button для колпак ученого (знаток)
[16:07:48] [DEBUG] Продажа подтверждена: доход=1554763, прибыль за шт=-264.59000000000015
[16:07:49] [DEBUG] Итерация завершена, failure_counter=0
[16:07:49] [DEBUG] OCR распознал предмет: 'колпак клирика (эксперт)'
[16:07:49] [DEBUG] Найдено 0 в purchase_log, 1 в table.xlsx
[16:07:49] [DEBUG] колпак клирика (эксперт) не найден в purchase_log, используем table.xlsx
[16:07:49] [DEBUG] Кликаем sell_button для колпак клирика (эксперт)
[16:07:49] [DEBUG] Кликаем minus_button для колпак клирика (эксперт)
[16:07:50] [DEBUG] Распознана цена продажи: 120803
[16:07:51] [DEBUG] Распознана цена продажи за предмет: 7724
[16:07:51] [DEBUG] Количество предметов в стеке: 17
[16:07:51] [DEBUG] Профит за 1 предмет: -287.0199999999995
[16:07:51] [DEBUG] Кликаем confirm_button для колпак клирика (эксперт)
[16:07:51] [DEBUG] Продажа подтверждена: доход=1675566, прибыль за шт=-287.0199999999995
[16:07:51] [DEBUG] Итерация завершена, failure_counter=0
[16:07:51] [DEBUG] OCR распознал предмет: 'колпак клирика (мастер)'
[16:07:51] [DEBUG] Найдено 0 в purchase_log, 1 в table.xlsx
[16:07:51] [DEBUG] колпак клирика (мастер) не найден в purchase_log, используем table.xlsx
[16:07:51] [DEBUG] Кликаем sell_button для колпак клирика (мастер)
[16:07:52] [DEBUG] Кликаем minus_button для колпак клирика (мастер)
[16:07:53] [DEBUG] Распознана цена продажи: 180224
[16:07:53] [DEBUG] Распознана цена продажи за предмет: 24487
[16:07:53] [DEBUG] Количество предметов в стеке: 8
[16:07:53] [DEBUG] Профит за 1 предмет: -2167.1349999999984
[16:07:53] [DEBUG] Кликаем confirm_button для колпак клирика (мастер)
[16:07:53] [DEBUG] Продажа подтверждена: доход=1855790, прибыль за шт=-2167.1349999999984
[16:07:53] [DEBUG] Итерация завершена, failure_counter=0
[16:07:54] [DEBUG] OCR распознал предмет: 'капюшон наемника (знаток)'
[16:07:54] [DEBUG] Найдено 0 в purchase_log, 1 в table.xlsx
[16:07:54] [DEBUG] капюшон наемника (знаток) не найден в purchase_log, используем table.xlsx
[16:07:54] [DEBUG] Кликаем sell_button для капюшон наемника (знаток)
[16:07:54] [DEBUG] Кликаем minus_button для капюшон наемника (знаток)
[16:07:55] [DEBUG] Распознана цена продажи: 35369
[16:07:56] [DEBUG] Распознана цена продажи за предмет: 3495
[16:07:56] [DEBUG] Количество предметов в стеке: 11
[16:07:56] [DEBUG] Профит за 1 предмет: -332.9749999999999
[16:07:56] [DEBUG] Кликаем confirm_button для капюшон наемника (знаток)
[16:07:56] [DEBUG] Продажа подтверждена: доход=1891159, прибыль за шт=-332.9749999999999
[16:07:56] [DEBUG] Итерация завершена, failure_counter=0
[16:07:56] [DEBUG] OCR распознал предмет: 'капюшон убийцы (эксперт)'
[16:07:56] [DEBUG] Найдено 0 в purchase_log, 1 в table.xlsx
[16:07:57] [DEBUG] капюшон убийцы (эксперт) не найден в purchase_log, используем table.xlsx
[16:07:57] [DEBUG] Кликаем sell_button для капюшон убийцы (эксперт)
[16:07:57] [DEBUG] Кликаем minus_button для капюшон убийцы (эксперт)
[16:07:58] [DEBUG] Распознана цена продажи: 127711
[16:07:59] [DEBUG] Распознана цена продажи за предмет: 8676
[16:07:59] [DEBUG] Количество предметов в стеке: 16
[16:07:59] [DEBUG] Профит за 1 предмет: -889.9799999999996
[16:07:59] [DEBUG] Кликаем confirm_button для капюшон убийцы (эксперт)
[16:07:59] [DEBUG] Продажа подтверждена: доход=2018870, прибыль за шт=-889.9799999999996
[16:07:59] [DEBUG] Итерация завершена, failure_counter=0
[16:07:59] [DEBUG] OCR распознал предмет: 'шлем хранителя (знаток)'
[16:07:59] [DEBUG] Найдено 0 в purchase_log, 1 в table.xlsx
[16:07:59] [DEBUG] шлем хранителя (знаток) не найден в purchase_log, используем table.xlsx
[16:07:59] [DEBUG] Кликаем sell_button для шлем хранителя (знаток)
[16:08:00] [DEBUG] Кликаем minus_button для шлем хранителя (знаток)
[16:08:00] [DEBUG] Распознана цена продажи: 85897
[16:08:01] [DEBUG] Распознана цена продажи за предмет: 2394
[16:08:01] [DEBUG] Количество предметов в стеке: 40
[16:08:01] [DEBUG] Профит за 1 предмет: -246.3699999999999
[16:08:01] [DEBUG] Кликаем confirm_button для шлем хранителя (знаток)
[16:08:01] [DEBUG] Продажа подтверждена: доход=2104767, прибыль за шт=-246.3699999999999
[16:08:01] [DEBUG] Итерация завершена, failure_counter=0
[16:08:02] [DEBUG] OCR распознал предмет: 'шлем солдата (знаток)'
[16:08:02] [DEBUG] Найдено 0 в purchase_log, 1 в table.xlsx
[16:08:02] [DEBUG] шлем солдата (знаток) не найден в purchase_log, используем table.xlsx
[16:08:02] [DEBUG] Кликаем sell_button для шлем солдата (знаток)
[16:08:02] [DEBUG] Кликаем minus_button для шлем солдата (знаток)
[16:08:03] [DEBUG] Распознана цена продажи: 17561
[16:08:04] [DEBUG] Распознана цена продажи за предмет: 2386
[16:08:04] [DEBUG] Количество предметов в стеке: 8
[16:08:04] [DEBUG] Профит за 1 предмет: -249.52999999999975
[16:08:04] [DEBUG] Кликаем confirm_button для шлем солдата (знаток)
[16:08:04] [DEBUG] Продажа подтверждена: доход=2122328, прибыль за шт=-249.52999999999975
[16:08:04] [DEBUG] Итерация завершена, failure_counter=0
[16:08:04] [DEBUG] OCR распознал предмет: 'капюшон убийцы (эксперт)'
[16:08:04] [DEBUG] Найдено 0 в purchase_log, 1 в table.xlsx
[16:08:04] [DEBUG] капюшон убийцы (эксперт) не найден в purchase_log, используем table.xlsx
[16:08:04] [DEBUG] Кликаем sell_button для капюшон убийцы (эксперт)
[16:08:05] [DEBUG] Кликаем minus_button для капюшон убийцы (эксперт)
[16:08:05] [DEBUG] Распознана цена продажи: 35873
[16:08:06] [DEBUG] Распознана цена продажи за предмет: 8675
[16:08:06] [DEBUG] Количество предметов в стеке: 4
[16:08:06] [DEBUG] Профит за 1 предмет: -890.875
[16:08:06] [DEBUG] Кликаем confirm_button для капюшон убийцы (эксперт)
[16:08:06] [DEBUG] Продажа подтверждена: доход=2158201, прибыль за шт=-890.875
[16:08:06] [DEBUG] Итерация завершена, failure_counter=0
[16:08:07] [DEBUG] OCR распознал предмет: 'куртка наемника (эксперт)'
[16:08:07] [DEBUG] Найдено 0 в purchase_log, 1 в table.xlsx
[16:08:07] [DEBUG] куртка наемника (эксперт) не найден в purchase_log, используем table.xlsx
[16:08:07] [DEBUG] Кликаем sell_button для куртка наемника (эксперт)
[16:08:07] [DEBUG] Кликаем minus_button для куртка наемника (эксперт)
[16:08:08] [DEBUG] Распознана цена продажи: 171981
[16:08:09] [DEBUG] Распознана цена продажи за предмет: 15578
[16:08:09] [DEBUG] Количество предметов в стеке: 12
[16:08:09] [DEBUG] Профит за 1 предмет: -1056.6900000000005
[16:08:09] [DEBUG] Кликаем confirm_button для куртка наемника (эксперт)
[16:08:09] [DEBUG] Продажа подтверждена: доход=2330182, прибыль за шт=-1056.6900000000005
[16:08:09] [DEBUG] Итерация завершена, failure_counter=0
[16:08:09] [DEBUG] OCR распознал предмет: 'броня рыцаря (эксперт)'
[16:08:09] [DEBUG] Найдено 0 в purchase_log, 1 в table.xlsx
[16:08:09] [DEBUG] броня рыцаря (эксперт) не найден в purchase_log, используем table.xlsx
[16:08:09] [DEBUG] Кликаем sell_button для броня рыцаря (эксперт)
[16:08:10] [DEBUG] Кликаем minus_button для броня рыцаря (эксперт)
[16:08:10] [DEBUG] Распознана цена продажи: 137794
[16:08:11] [DEBUG] Распознана цена продажи за предмет: 13616
[16:08:11] [DEBUG] Количество предметов в стеке: 11
[16:08:11] [DEBUG] Профит за 1 предмет: -1300.6800000000003
[16:08:11] [DEBUG] Кликаем confirm_button для броня рыцаря (эксперт)
[16:08:11] [DEBUG] Продажа подтверждена: доход=2467976, прибыль за шт=-1300.6800000000003
[16:08:11] [DEBUG] Итерация завершена, failure_counter=0
[16:08:12] [DEBUG] OCR распознал предмет: 'колпак клирика (знаток)'
[16:08:12] [DEBUG] Найдено 1 в purchase_log, 1 в table.xlsx
[16:08:12] [DEBUG] WAPP для колпак клирика (знаток): 1447.0
[16:08:12] [DEBUG] Кликаем sell_button для колпак клирика (знаток)
[16:08:12] [DEBUG] Кликаем minus_button для колпак клирика (знаток)
[16:08:13] [DEBUG] Распознана цена продажи: 1264
[16:08:14] [DEBUG] Распознана цена продажи за предмет: 2632
[16:08:14] [DEBUG] Количество предметов в стеке: 0
[16:08:14] [DEBUG] Профит за 1 предмет: 908.6399999999999
[16:08:14] [DEBUG] Кликаем confirm_button для колпак клирика (знаток)
[16:08:14] [DEBUG] Продажа подтверждена: доход=2469240, прибыль за шт=908.6399999999999
[16:08:14] [DEBUG] Итерация завершена, failure_counter=0
[16:08:14] [DEBUG] OCR распознал предмет: 'капюшон убийцы (эксперт)'
[16:08:14] [DEBUG] Найдено 0 в purchase_log, 1 в table.xlsx
[16:08:14] [DEBUG] капюшон убийцы (эксперт) не найден в purchase_log, используем table.xlsx
[16:08:14] [DEBUG] Кликаем sell_button для капюшон убийцы (эксперт)
[16:08:15] [DEBUG] Кликаем minus_button для капюшон убийцы (эксперт)
[16:08:16] [DEBUG] Распознана цена продажи: 39910
[16:08:16] [DEBUG] Распознана цена продажи за предмет: 8676
[16:08:16] [DEBUG] Количество предметов в стеке: 5
[16:08:16] [DEBUG] Профит за 1 предмет: -889.9799999999996
[16:08:16] [DEBUG] Кликаем confirm_button для капюшон убийцы (эксперт)
[16:08:16] [DEBUG] Продажа подтверждена: доход=2509150, прибыль за шт=-889.9799999999996
[16:08:16] [DEBUG] Итерация завершена, failure_counter=0
[16:08:17] [DEBUG] OCR распознал предмет: 'сандалии чародея (знаток)'
[16:08:17] [DEBUG] Найдено 0 в purchase_log, 1 в table.xlsx
[16:08:17] [DEBUG] сандалии чародея (знаток) не найден в purchase_log, используем table.xlsx
[16:08:17] [DEBUG] Кликаем sell_button для сандалии чародея (знаток)
[16:08:17] [DEBUG] Кликаем minus_button для сандалии чародея (знаток)
[16:08:18] [DEBUG] Распознана цена продажи: 66650
[16:08:19] [DEBUG] Распознана цена продажи за предмет: 3293
[16:08:19] [DEBUG] Количество предметов в стеке: 22
[16:08:19] [DEBUG] Профит за 1 предмет: 152.23500000000013
[16:08:19] [DEBUG] Кликаем confirm_button для сандалии чародея (знаток)
[16:08:19] [DEBUG] Продажа подтверждена: доход=2575800, прибыль за шт=152.23500000000013
[16:08:19] [DEBUG] Итерация завершена, failure_counter=0
[16:08:19] [DEBUG] OCR распознал предмет: 'шлем солдата (знаток)'
[16:08:19] [DEBUG] Найдено 0 в purchase_log, 1 в table.xlsx
[16:08:19] [DEBUG] шлем солдата (знаток) не найден в purchase_log, используем table.xlsx
[16:08:19] [DEBUG] Кликаем sell_button для шлем солдата (знаток)
[16:08:20] [DEBUG] Кликаем minus_button для шлем солдата (знаток)
[16:08:21] [DEBUG] Распознана цена продажи: 17561
[16:08:21] [DEBUG] Распознана цена продажи за предмет: 2386
[16:08:21] [DEBUG] Количество предметов в стеке: 8
[16:08:21] [DEBUG] Профит за 1 предмет: -249.52999999999975
[16:08:21] [DEBUG] Кликаем confirm_button для шлем солдата (знаток)
[16:08:21] [DEBUG] Продажа подтверждена: доход=2593361, прибыль за шт=-249.52999999999975
[16:08:22] [DEBUG] Итерация завершена, failure_counter=0
[16:08:22] [DEBUG] OCR распознал предмет: 'колпак клирика (знаток)'
[16:08:22] [DEBUG] Найдено 1 в purchase_log, 1 в table.xlsx
[16:08:22] [DEBUG] WAPP для колпак клирика (знаток): 1447.0
[16:08:22] [DEBUG] Кликаем sell_button для колпак клирика (знаток)
[16:08:23] [DEBUG] Кликаем minus_button для колпак клирика (знаток)
[16:08:23] [DEBUG] Распознана цена продажи: 14507
[16:08:24] [DEBUG] Распознана цена продажи за предмет: 2628
[16:08:24] [DEBUG] Количество предметов в стеке: 6
[16:08:24] [DEBUG] Профит за 1 предмет: 905.06
[16:08:24] [DEBUG] Кликаем confirm_button для колпак клирика (знаток)
[16:08:24] [DEBUG] Продажа подтверждена: доход=2607868, прибыль за шт=905.06
[16:08:24] [DEBUG] Итерация завершена, failure_counter=0
[16:08:25] [DEBUG] OCR распознал предмет: 'куртка наемника (эксперт)'
[16:08:25] [DEBUG] Найдено 0 в purchase_log, 1 в table.xlsx
[16:08:25] [DEBUG] куртка наемника (эксперт) не найден в purchase_log, используем table.xlsx
[16:08:25] [DEBUG] Кликаем sell_button для куртка наемника (эксперт)
[16:08:25] [DEBUG] Кликаем minus_button для куртка наемника (эксперт)
[16:08:26] [DEBUG] Распознана цена продажи: 157649
[16:08:27] [DEBUG] Распознана цена продажи за предмет: 15577
[16:08:27] [DEBUG] Количество предметов в стеке: 11
[16:08:27] [DEBUG] Профит за 1 предмет: -1057.5849999999991
[16:08:27] [DEBUG] Кликаем confirm_button для куртка наемника (эксперт)
[16:08:27] [DEBUG] Продажа подтверждена: доход=2765517, прибыль за шт=-1057.5849999999991
[16:08:27] [DEBUG] Итерация завершена, failure_counter=0
[16:08:27] [DEBUG] OCR распознал предмет: 'куртка охотника (эксперт)'
[16:08:27] [DEBUG] Найдено 0 в purchase_log, 1 в table.xlsx
[16:08:27] [DEBUG] куртка охотника (эксперт) не найден в purchase_log, используем table.xlsx
[16:08:27] [DEBUG] Кликаем sell_button для куртка охотника (эксперт)
[16:08:28] [DEBUG] Кликаем minus_button для куртка охотника (эксперт)
[16:08:29] [DEBUG] Распознана цена продажи: 107535
[16:08:29] [DEBUG] Распознана цена продажи за предмет: 16698
[16:08:29] [DEBUG] Количество предметов в стеке: 7
[16:08:29] [DEBUG] Профит за 1 предмет: -1852.289999999999
[16:08:29] [DEBUG] Кликаем confirm_button для куртка охотника (эксперт)
[16:08:29] [DEBUG] Продажа подтверждена: доход=2873052, прибыль за шт=-1852.289999999999
[16:08:29] [DEBUG] Итерация завершена, failure_counter=0
[16:08:30] [DEBUG] OCR распознал предмет: 'колпак ученого (мастер)'
[16:08:30] [DEBUG] Найдено 0 в purchase_log, 1 в table.xlsx
[16:08:30] [DEBUG] колпак ученого (мастер) не найден в purchase_log, используем table.xlsx
[16:08:30] [DEBUG] Кликаем sell_button для колпак ученого (мастер)
[16:08:30] [DEBUG] Кликаем minus_button для колпак ученого (мастер)
[16:08:31] [DEBUG] Распознана цена продажи: 43179
[16:08:32] [DEBUG] Распознана цена продажи за предмет: 23467
[16:08:32] [DEBUG] Количество предметов в стеке: 2
[16:08:32] [DEBUG] Профит за 1 предмет: -2789.035
[16:08:32] [DEBUG] Кликаем confirm_button для колпак ученого (мастер)
[16:08:32] [DEBUG] Продажа подтверждена: доход=2916231, прибыль за шт=-2789.035
[16:08:32] [DEBUG] Итерация завершена, failure_counter=0
[16:08:32] [DEBUG] OCR распознал предмет: 'колпак ученого (мастер)'
[16:08:32] [DEBUG] Найдено 0 в purchase_log, 1 в table.xlsx
[16:08:32] [DEBUG] колпак ученого (мастер) не найден в purchase_log, используем table.xlsx
[16:08:32] [DEBUG] Кликаем sell_button для колпак ученого (мастер)
[16:08:33] [DEBUG] Кликаем minus_button для колпак ученого (мастер)
[16:08:34] [DEBUG] Распознана цена продажи: 171701
[16:08:34] [DEBUG] Распознана цена продажи за предмет: 23329
[16:08:34] [DEBUG] Количество предметов в стеке: 8
[16:08:34] [DEBUG] Профит за 1 предмет: -2912.5449999999983
[16:08:34] [DEBUG] Кликаем confirm_button для колпак ученого (мастер)
[16:08:34] [DEBUG] Продажа подтверждена: доход=3087932, прибыль за шт=-2912.5449999999983
[16:08:34] [DEBUG] Итерация завершена, failure_counter=0
[16:08:35] [DEBUG] OCR распознал предмет: 'шлем хранителя (знаток)'
[16:08:35] [DEBUG] Найдено 0 в purchase_log, 1 в table.xlsx
[16:08:35] [DEBUG] шлем хранителя (знаток) не найден в purchase_log, используем table.xlsx
[16:08:35] [DEBUG] Кликаем sell_button для шлем хранителя (знаток)
[16:08:35] [DEBUG] Кликаем minus_button для шлем хранителя (знаток)
[16:08:36] [DEBUG] Распознана цена продажи: 11012
[16:08:37] [DEBUG] Распознана цена продажи за предмет: 2393
[16:08:37] [DEBUG] Количество предметов в стеке: 5
[16:08:37] [DEBUG] Профит за 1 предмет: -247.26499999999987
[16:08:37] [DEBUG] Кликаем confirm_button для шлем хранителя (знаток)
[16:08:37] [DEBUG] Продажа подтверждена: доход=3098944, прибыль за шт=-247.26499999999987
[16:08:37] [DEBUG] Итерация завершена, failure_counter=0
[16:08:38] [DEBUG] OCR распознал предмет: 'шлем солдата (знаток)'
[16:08:38] [DEBUG] Найдено 0 в purchase_log, 1 в table.xlsx
[16:08:38] [DEBUG] шлем солдата (знаток) не найден в purchase_log, используем table.xlsx
[16:08:38] [DEBUG] Кликаем sell_button для шлем солдата (знаток)
[16:08:38] [DEBUG] Кликаем minus_button для шлем солдата (знаток)
[16:08:39] [DEBUG] Распознана цена продажи: 50488
[16:08:40] [DEBUG] Распознана цена продажи за предмет: 2385
[16:08:40] [DEBUG] Количество предметов в стеке: 23
[16:08:40] [DEBUG] Профит за 1 предмет: -250.42500000000018
[16:08:40] [DEBUG] Кликаем confirm_button для шлем солдата (знаток)
[16:08:40] [DEBUG] Продажа подтверждена: доход=3149432, прибыль за шт=-250.42500000000018
[16:08:40] [DEBUG] Итерация завершена, failure_counter=0
[16:08:40] [DEBUG] OCR распознал предмет: 'колпак чародея (старейшина)'
[16:08:40] [DEBUG] Найдено 0 в purchase_log, 1 в table.xlsx
[16:08:40] [DEBUG] колпак чародея (старейшина) не найден в purchase_log, используем table.xlsx
[16:08:40] [DEBUG] Кликаем sell_button для колпак чародея (старейшина)
[16:08:41] [DEBUG] Кликаем minus_button для колпак чародея (старейшина)
[16:08:42] [DEBUG] Распознана цена продажи: 146276
[16:08:42] [DEBUG] Распознана цена продажи за предмет: 158996
[16:08:42] [DEBUG] Количество предметов в стеке: 1
[16:08:42] [DEBUG] Профит за 1 предмет: -17646.579999999987
[16:08:42] [DEBUG] Кликаем confirm_button для колпак чародея (старейшина)
[16:08:43] [DEBUG] Продажа подтверждена: доход=3295708, прибыль за шт=-17646.579999999987
[16:08:43] [DEBUG] Итерация завершена, failure_counter=0
[16:08:43] [DEBUG] OCR распознал предмет: 'колпак чародея (мастер)'
[16:08:43] [DEBUG] Найдено 0 в purchase_log, 1 в table.xlsx
[16:08:43] [DEBUG] колпак чародея (мастер) не найден в purchase_log, используем table.xlsx
[16:08:43] [DEBUG] Кликаем sell_button для колпак чародея (мастер)
[16:08:43] [DEBUG] Кликаем minus_button для колпак чародея (мастер)
[16:08:44] [DEBUG] Распознана цена продажи: 45038
[16:08:45] [DEBUG] Распознана цена продажи за предмет: 24477
[16:08:45] [DEBUG] Количество предметов в стеке: 2
[16:08:45] [DEBUG] Профит за 1 предмет: -2431.084999999999
[16:08:45] [DEBUG] Кликаем confirm_button для колпак чародея (мастер)
[16:08:45] [DEBUG] Продажа подтверждена: доход=3340746, прибыль за шт=-2431.084999999999
[16:08:45] [DEBUG] Итерация завершена, failure_counter=0
[16:08:45] [DEBUG] OCR распознал предмет: 'шлем рыцаря (знаток)'
[16:08:45] [DEBUG] Найдено 0 в purchase_log, 1 в table.xlsx
[16:08:45] [DEBUG] шлем рыцаря (знаток) не найден в purchase_log, используем table.xlsx
[16:08:45] [DEBUG] Кликаем sell_button для шлем рыцаря (знаток)
[16:08:46] [DEBUG] Кликаем minus_button для шлем рыцаря (знаток)
[16:08:47] [DEBUG] Распознана цена продажи: 47730
[16:08:47] [DEBUG] Распознана цена продажи за предмет: 2594
[16:08:47] [DEBUG] Количество предметов в стеке: 20
[16:08:47] [DEBUG] Профит за 1 предмет: -266.3699999999999
[16:08:47] [DEBUG] Кликаем confirm_button для шлем рыцаря (знаток)
[16:08:47] [DEBUG] Продажа подтверждена: доход=3388476, прибыль за шт=-266.3699999999999
[16:08:47] [DEBUG] Итерация завершена, failure_counter=0
[16:08:48] [DEBUG] OCR распознал предмет: 'шлем рыцаря (знаток)'
[16:08:48] [DEBUG] Найдено 0 в purchase_log, 1 в table.xlsx
[16:08:48] [DEBUG] шлем рыцаря (знаток) не найден в purchase_log, используем table.xlsx
[16:08:48] [DEBUG] Кликаем sell_button для шлем рыцаря (знаток)
[16:08:48] [DEBUG] Кликаем minus_button для шлем рыцаря (знаток)
[16:08:49] [DEBUG] Распознана цена продажи: 37209
[16:08:50] [DEBUG] Распознана цена продажи за предмет: 2591
[16:08:50] [DEBUG] Количество предметов в стеке: 16
[16:08:50] [DEBUG] Профит за 1 предмет: -269.05499999999984
[16:08:50] [DEBUG] Кликаем confirm_button для шлем рыцаря (знаток)
[16:08:50] [DEBUG] Продажа подтверждена: доход=3425685, прибыль за шт=-269.05499999999984
[16:08:50] [DEBUG] Итерация завершена, failure_counter=0
[16:08:50] [DEBUG] OCR распознал предмет: 'колпак чародея (мастер)'
[16:08:50] [DEBUG] Найдено 0 в purchase_log, 1 в table.xlsx
[16:08:50] [DEBUG] колпак чародея (мастер) не найден в purchase_log, используем table.xlsx
[16:08:50] [DEBUG] Кликаем sell_button для колпак чародея (мастер)
[16:08:51] [DEBUG] Кликаем minus_button для колпак чародея (мастер)
[16:08:52] [DEBUG] Распознана цена продажи: 110386
[16:08:52] [DEBUG] Распознана цена продажи за предмет: 23997
[16:08:52] [DEBUG] Количество предметов в стеке: 5
[16:08:52] [DEBUG] Профит за 1 предмет: -2860.6850000000013
[16:08:52] [DEBUG] Кликаем confirm_button для колпак чародея (мастер)
[16:08:52] [DEBUG] Продажа подтверждена: доход=3536071, прибыль за шт=-2860.6850000000013
[16:08:52] [DEBUG] Итерация завершена, failure_counter=0
[16:08:53] [DEBUG] OCR распознал предмет: 'капюшон наемника (знаток)'
[16:08:53] [DEBUG] Найдено 0 в purchase_log, 1 в table.xlsx
[16:08:53] [DEBUG] капюшон наемника (знаток) не найден в purchase_log, используем table.xlsx
[16:08:53] [DEBUG] Кликаем sell_button для капюшон наемника (знаток)
[16:08:54] [DEBUG] Кликаем minus_button для капюшон наемника (знаток)
[16:08:54] [DEBUG] Распознана цена продажи: 16091
[16:08:55] [DEBUG] Распознана цена продажи за предмет: 3498
[16:08:55] [DEBUG] Количество предметов в стеке: 5
[16:08:55] [DEBUG] Профит за 1 предмет: -330.28999999999996
[16:08:55] [DEBUG] Кликаем confirm_button для капюшон наемника (знаток)
[16:08:55] [DEBUG] Продажа подтверждена: доход=3552162, прибыль за шт=-330.28999999999996
[16:08:55] [DEBUG] Итерация завершена, failure_counter=0
[16:08:56] [DEBUG] OCR распознал предмет: 'шлем хранителя (знаток)'
[16:08:56] [DEBUG] Найдено 0 в purchase_log, 1 в table.xlsx
[16:08:56] [DEBUG] шлем хранителя (знаток) не найден в purchase_log, используем table.xlsx
[16:08:56] [DEBUG] Кликаем sell_button для шлем хранителя (знаток)
[16:08:56] [DEBUG] Кликаем minus_button для шлем хранителя (знаток)
[16:08:57] [DEBUG] Распознана цена продажи: 17620
[16:08:57] [DEBUG] Распознана цена продажи за предмет: 2394
[16:08:57] [DEBUG] Количество предметов в стеке: 8
[16:08:57] [DEBUG] Профит за 1 предмет: -246.3699999999999
[16:08:57] [DEBUG] Кликаем confirm_button для шлем хранителя (знаток)
[16:08:57] [DEBUG] Продажа подтверждена: доход=3569782, прибыль за шт=-246.3699999999999
[16:08:57] [DEBUG] Итерация завершена, failure_counter=0
[16:08:58] [DEBUG] OCR распознал предмет: 'колпак клирика (мастер)'
[16:08:58] [DEBUG] Найдено 0 в purchase_log, 1 в table.xlsx
[16:08:58] [DEBUG] колпак клирика (мастер) не найден в purchase_log, используем table.xlsx
[16:08:58] [DEBUG] Кликаем sell_button для колпак клирика (мастер)
[16:08:58] [DEBUG] Кликаем minus_button для колпак клирика (мастер)
[16:08:59] [DEBUG] Распознана цена продажи: 67584
[16:09:00] [DEBUG] Распознана цена продажи за предмет: 24486
[16:09:00] [DEBUG] Количество предметов в стеке: 3
[16:09:00] [DEBUG] Профит за 1 предмет: -2168.029999999999
[16:09:00] [DEBUG] Кликаем confirm_button для колпак клирика (мастер)
[16:09:00] [DEBUG] Продажа подтверждена: доход=3637366, прибыль за шт=-2168.029999999999
[16:09:00] [DEBUG] Итерация завершена, failure_counter=0
[16:09:00] [DEBUG] OCR распознал предмет: 'колпак ученого (знаток)'
[16:09:00] [DEBUG] Найдено 0 в purchase_log, 1 в table.xlsx
[16:09:00] [DEBUG] колпак ученого (знаток) не найден в purchase_log, используем table.xlsx
[16:09:01] [DEBUG] Кликаем sell_button для колпак ученого (знаток)
[16:09:01] [DEBUG] Кликаем minus_button для колпак ученого (знаток)
[16:09:02] [DEBUG] Распознана цена продажи: 21703
[16:09:03] [DEBUG] Распознана цена продажи за предмет: 2358
[16:09:03] [DEBUG] Количество предметов в стеке: 10
[16:09:03] [DEBUG] Профит за 1 предмет: -264.59000000000015
[16:09:03] [DEBUG] Кликаем confirm_button для колпак ученого (знаток)
[16:09:03] [DEBUG] Продажа подтверждена: доход=3659069, прибыль за шт=-264.59000000000015
[16:09:03] [DEBUG] Итерация завершена, failure_counter=0
[16:09:03] [DEBUG] OCR распознал предмет: 'колпак ученого (знаток)'
[16:09:03] [DEBUG] Найдено 0 в purchase_log, 1 в table.xlsx
[16:09:03] [DEBUG] колпак ученого (знаток) не найден в purchase_log, используем table.xlsx
[16:09:03] [DEBUG] Кликаем sell_button для колпак ученого (знаток)
[16:09:04] [DEBUG] Кликаем minus_button для колпак ученого (знаток)
[16:09:04] [DEBUG] Распознана цена продажи: 4388
[16:09:05] [DEBUG] Распознана цена продажи за предмет: 2385
[16:09:05] [DEBUG] Количество предметов в стеке: 2
[16:09:05] [DEBUG] Профит за 1 предмет: -240.42500000000018
[16:09:05] [DEBUG] Кликаем confirm_button для колпак ученого (знаток)
[16:09:05] [DEBUG] Продажа подтверждена: доход=3663457, прибыль за шт=-240.42500000000018
[16:09:05] [DEBUG] Итерация завершена, failure_counter=0
[16:09:06] [DEBUG] OCR распознал предмет: 'броня солдата (эксперт)'
[16:09:06] [DEBUG] Найдено 0 в purchase_log, 1 в table.xlsx
[16:09:06] [DEBUG] броня солдата (эксперт) не найден в purchase_log, используем table.xlsx
[16:09:06] [DEBUG] Кликаем sell_button для броня солдата (эксперт)
[16:09:06] [DEBUG] Кликаем minus_button для броня солдата (эксперт)
[16:09:07] [DEBUG] Распознана цена продажи: 171064
[16:09:08] [DEBUG] Распознана цена продажи за предмет: 14302
[16:09:08] [DEBUG] Количество предметов в стеке: 13
[16:09:08] [DEBUG] Профит за 1 предмет: -1198.7099999999991
[16:09:08] [DEBUG] Кликаем confirm_button для броня солдата (эксперт)
[16:09:08] [DEBUG] Продажа подтверждена: доход=3834521, прибыль за шт=-1198.7099999999991
[16:09:08] [DEBUG] Итерация завершена, failure_counter=0
[16:09:08] [DEBUG] OCR распознал предмет: 'броня солдата (знаток)'
[16:09:08] [DEBUG] Найдено 1 в purchase_log, 1 в table.xlsx
[16:09:08] [DEBUG] WAPP для броня солдата (знаток): 2965.0
[16:09:08] [DEBUG] Кликаем sell_button для броня солдата (знаток)
[16:09:09] [DEBUG] Кликаем minus_button для броня солдата (знаток)
[16:09:10] [DEBUG] Распознана цена продажи: 9384
[16:09:10] [DEBUG] Распознана цена продажи за предмет: 5100
[16:09:10] [DEBUG] Количество предметов в стеке: 2
[16:09:10] [DEBUG] Профит за 1 предмет: 1599.5
[16:09:10] [DEBUG] Кликаем confirm_button для броня солдата (знаток)
[16:09:10] [DEBUG] Продажа подтверждена: доход=3843905, прибыль за шт=1599.5
[16:09:10] [DEBUG] Итерация завершена, failure_counter=0
[16:09:11] [DEBUG] OCR распознал предмет: 'броня рыцаря (эксперт)'
[16:09:11] [DEBUG] Найдено 0 в purchase_log, 1 в table.xlsx
[16:09:11] [DEBUG] броня рыцаря (эксперт) не найден в purchase_log, используем table.xlsx
[16:09:11] [DEBUG] Кликаем sell_button для броня рыцаря (эксперт)
[16:09:11] [DEBUG] Кликаем minus_button для броня рыцаря (эксперт)
[16:09:12] [DEBUG] Распознана цена продажи: 112749
[16:09:13] [DEBUG] Распознана цена продажи за предмет: 13616
[16:09:13] [DEBUG] Количество предметов в стеке: 9
[16:09:13] [DEBUG] Профит за 1 предмет: -1300.6800000000003
[16:09:13] [DEBUG] Кликаем confirm_button для броня рыцаря (эксперт)
[16:09:13] [DEBUG] Продажа подтверждена: доход=3956654, прибыль за шт=-1300.6800000000003
[16:09:13] [DEBUG] Итерация завершена, failure_counter=0
[16:09:13] [DEBUG] OCR распознал предмет: '—'
[16:09:13] [DEBUG] Найдено 0 в purchase_log, 0 в table.xlsx
[16:09:13] [DEBUG] — отсутствует и в purchase_log, и в table.xlsx, попытка 1
[16:09:15] [DEBUG] OCR распознал предмет: '—'
[16:09:15] [DEBUG] Найдено 0 в purchase_log, 0 в table.xlsx
[16:09:15] [DEBUG] — отсутствует и в purchase_log, и в table.xlsx, попытка 2
[16:09:16] [DEBUG] OCR распознал предмет: '—'
[16:09:16] [DEBUG] Найдено 0 в purchase_log, 0 в table.xlsx
[16:09:16] [DEBUG] — отсутствует и в purchase_log, и в table.xlsx, попытка 3
[16:09:17] [DEBUG] OCR распознал предмет: '—'
[16:09:17] [DEBUG] Найдено 0 в purchase_log, 0 в table.xlsx
[16:09:17] [DEBUG] — отсутствует и в purchase_log, и в table.xlsx, попытка 4
[16:09:18] [DEBUG] OCR распознал предмет: '—'
[16:09:18] [DEBUG] Найдено 0 в purchase_log, 0 в table.xlsx
[16:09:18] [DEBUG] — отсутствует и в purchase_log, и в table.xlsx, попытка 5
[16:09:19] [DEBUG] Сформирован отчет:
--- Итог сессии ---
Доход: 3956654
Расход: 2560000
Прибыль: 1396654
куртка наемника (мастер) x0 | Продажа: 30594 | Прибыль за шт: -5624.264999999999
куртка наемника (мастер) x8 | Продажа: 404741 | Прибыль за шт: -5625.159999999996
капюшон наемника (эксперт) x14 | Продажа: 115894 | Прибыль за шт: 66.31500000000051
колпак клирика (эксперт) x18 | Продажа: 127909 | Прибыль за шт: -287.0199999999995
колпак ученого (знаток) x6 | Продажа: 13022 | Прибыль за шт: -263.69500000000016
броня солдата (эксперт) x12 | Продажа: 157905 | Прибыль за шт: -1197.8150000000005
колпак ученого (мастер) x1 | Продажа: 21611 | Прибыль за шт: -2768.4500000000007
броня рыцаря (эксперт) x1 | Продажа: 12528 | Прибыль за шт: -1299.7849999999999
куртка наемника (эксперт) x10 | Продажа: 143327 | Прибыль за шт: -1055.795
куртка охотника (эксперт) x9 | Продажа: 138259 | Прибыль за шт: -1852.289999999999
броня солдата (эксперт) x1 | Продажа: 13257 | Прибыль за шт: -1102.0499999999993
колпак клирика (мастер) x6 | Продажа: 136857 | Прибыль за шт: -1893.2649999999994
колпак чародея (мастер) x9 | Продажа: 202661 | Прибыль за шт: -2431.9799999999996
капюшон наемника (эксперт) x1 | Продажа: 14495 | Прибыль за шт: 66.31500000000051
колпак ученого (знаток) x10 | Продажа: 21703 | Прибыль за шт: -264.59000000000015
колпак клирика (эксперт) x17 | Продажа: 120803 | Прибыль за шт: -287.0199999999995
колпак клирика (мастер) x8 | Продажа: 180224 | Прибыль за шт: -2167.1349999999984
капюшон наемника (знаток) x11 | Продажа: 35369 | Прибыль за шт: -332.9749999999999
капюшон убийцы (эксперт) x16 | Продажа: 127711 | Прибыль за шт: -889.9799999999996
шлем хранителя (знаток) x40 | Продажа: 85897 | Прибыль за шт: -246.3699999999999
шлем солдата (знаток) x8 | Продажа: 17561 | Прибыль за шт: -249.52999999999975
капюшон убийцы (эксперт) x4 | Продажа: 35873 | Прибыль за шт: -890.875
куртка наемника (эксперт) x12 | Продажа: 171981 | Прибыль за шт: -1056.6900000000005
броня рыцаря (эксперт) x11 | Продажа: 137794 | Прибыль за шт: -1300.6800000000003
колпак клирика (знаток) x0 | Продажа: 1264 | Прибыль за шт: 908.6399999999999
капюшон убийцы (эксперт) x5 | Продажа: 39910 | Прибыль за шт: -889.9799999999996
сандалии чародея (знаток) x22 | Продажа: 66650 | Прибыль за шт: 152.23500000000013
шлем солдата (знаток) x8 | Продажа: 17561 | Прибыль за шт: -249.52999999999975
колпак клирика (знаток) x6 | Продажа: 14507 | Прибыль за шт: 905.06
куртка наемника (эксперт) x11 | Продажа: 157649 | Прибыль за шт: -1057.5849999999991
куртка охотника (эксперт) x7 | Продажа: 107535 | Прибыль за шт: -1852.289999999999
колпак ученого (мастер) x2 | Продажа: 43179 | Прибыль за шт: -2789.035
колпак ученого (мастер) x8 | Продажа: 171701 | Прибыль за шт: -2912.5449999999983
шлем хранителя (знаток) x5 | Продажа: 11012 | Прибыль за шт: -247.26499999999987
шлем солдата (знаток) x23 | Продажа: 50488 | Прибыль за шт: -250.42500000000018
колпак чародея (старейшина) x1 | Продажа: 146276 | Прибыль за шт: -17646.579999999987
колпак чародея (мастер) x2 | Продажа: 45038 | Прибыль за шт: -2431.084999999999
шлем рыцаря (знаток) x20 | Продажа: 47730 | Прибыль за шт: -266.3699999999999
шлем рыцаря (знаток) x16 | Продажа: 37209 | Прибыль за шт: -269.05499999999984
колпак чародея (мастер) x5 | Продажа: 110386 | Прибыль за шт: -2860.6850000000013
капюшон наемника (знаток) x5 | Продажа: 16091 | Прибыль за шт: -330.28999999999996
шлем хранителя (знаток) x8 | Продажа: 17620 | Прибыль за шт: -246.3699999999999
колпак клирика (мастер) x3 | Продажа: 67584 | Прибыль за шт: -2168.029999999999
колпак ученого (знаток) x10 | Продажа: 21703 | Прибыль за шт: -264.59000000000015
колпак ученого (знаток) x2 | Продажа: 4388 | Прибыль за шт: -240.42500000000018
броня солдата (эксперт) x13 | Продажа: 171064 | Прибыль за шт: -1198.7099999999991
броня солдата (знаток) x2 | Продажа: 9384 | Прибыль за шт: 1599.5
броня рыцаря (эксперт) x9 | Продажа: 112749 | Прибыль за шт: -1300.6800000000003