--- Итог сессии ---
Доход: 6520458
Расход: 4000000
Прибыль: 2520458
колпак ученого (мастер) x5 | Продажа: 87395 | Прибыль за шт: -6787.895
броня солдата (знаток) x4 | Продажа: 19748 | Прибыль за шт: 1598.6050000000005
капюшон наемника (знаток) x1 | Продажа: 3571 | Прибыль за шт: 13.389999999999873
капюшон убийцы (знаток) x2 | Продажа: 6341 | Прибыль за шт: 1188.17
мантия клирика (мастер) x8 | Продажа: 359661 | Прибыль за шт: 4644.965000000004
мантия ученого (знаток) x5 | Продажа: 29054 | Прибыль за шт: 2174.8199999999997
капюшон убийцы (мастер) x7 | Продажа: 224589 | Прибыль за шт: 3309.2299999999996
куртка убийцы (эксперт) x12 | Продажа: 166483 | Прибыль за шт: 3012.6000000000004
капюшон убийцы (мастер) x6 | Продажа: 192510 | Прибыль за шт: 3310.125
броня солдата (знаток) x9 | Продажа: 42228 | Прибыль за шт: 1597.71
шлем солдата (эксперт) x1 | Продажа: 6320 | Прибыль за шт: 1341.6500000000005
колпак чародея (мастер) x1 | Продажа: 22988 | Прибыль за шт: -1974.6349999999984
капюшон наемника (знаток) x5 | Продажа: 16086 | Прибыль за шт: -331.18499999999995
колпак клирика (знаток) x25 | Продажа: 60421 | Прибыль за шт: 904.165
шлем хранителя (мастер) x9 | Продажа: 187807 | Прибыль за шт: 2542.3899999999994
шлем рыцаря (мастер) x4 | Продажа: 80839 | Прибыль за шт: 2461.465
броня хранителя (эксперт) x9 | Продажа: 114007 | Прибыль за шт: 2882.255000000001
броня солдата (эксперт) x1 | Продажа: 13158 | Прибыль за шт: -1198.7099999999991
капюшон убийцы (знаток) x95 | Продажа: 294840 | Прибыль за шт: 1187.275
броня солдата (эксперт) x1 | Продажа: 13619 | Прибыль за шт: -750.3150000000005
куртка убийцы (эксперт) x6 | Продажа: 83242 | Прибыль за шт: 3011.705
куртка охотника (эксперт) x4 | Продажа: 61445 | Прибыль за шт: -1853.1849999999995
куртка наемника (мастер) x0 | Продажа: 30598 | Прибыль за шт: -5619.790000000001
капюшон убийцы (мастер) x3 | Продажа: 96261 | Прибыль за шт: 3311.915000000001
мантия чародея (знаток) x5 | Продажа: 23322 | Прибыль за шт: 1748.6499999999996
куртка охотника (эксперт) x1 | Продажа: 15361 | Прибыль за шт: -1854.08
колпак чародея (эксперт) x18 | Продажа: 123885 | Прибыль за шт: 1459.495
колпак чародея (эксперт) x18 | Продажа: 123885 | Прибыль за шт: 1459.495
мантия клирика (мастер) x11 | Продажа: 494575 | Прибыль за шт: 4648.544999999998
броня солдата (эксперт) x1 | Продажа: 13159 | Прибыль за шт: -1197.8150000000005
шлем рыцаря (мастер) x8 | Продажа: 161640 | Прибыль за шт: 2456.9900000000016
шлем рыцаря (старейшина) x2 | Продажа: 244711 | Прибыль за шт: 17475.52500000001
капюшон наемника (эксперт) x4 | Продажа: 33113 | Прибыль за шт: 67.21000000000004
капюшон наемника (эксперт) x1 | Продажа: 8277 | Прибыль за шт: 66.31500000000051
шлем хранителя (знаток) x1 | Продажа: 2202 | Прибыль за шт: -247.26499999999987
шлем хранителя (мастер) x11 | Продажа: 229542 | Прибыль за шт: 2542.3899999999994
шлем рыцаря (мастер) x46 | Продажа: 909475 | Прибыль за шт: 2462.3600000000006
куртка охотника (знаток) x2 | Продажа: 9715 | Прибыль за шт: 1819.6000000000004
мантия ученого (знаток) x11 | Продажа: 63958 | Прибыль за шт: 2178.4000000000005
мантия ученого (знаток) x30 | Продажа: 174432 | Прибыль за шт: 2177.505
мантия клирика (мастер) x6 | Продажа: 256669 | Прибыль за шт: 2524.709999999999
мантия клирика (знаток) x3 | Продажа: 12323 | Прибыль за шт: 1536.1750000000002
капюшон убийцы (знаток) x9 | Продажа: 30725 | Прибыль за шт: 1187.275
капюшон охотника (знаток) x104 | Продажа: 326376 | Прибыль за шт: 1242.81
броня хранителя (эксперт) x14 | Продажа: 177345 | Прибыль за шт: 2882.255000000001
капюшон охотника (знаток) x2 | Продажа: 6400 | Прибыль за шт: 1241.915
куртка охотника (мастер) x17 | Продажа: 806430 | Прибыль за шт: 4958.989999999998
мантия клирика (эксперт) x3 | Продажа: 45438 | Прибыль за шт: 3212.385
колпак клирика (эксперт) x2 | Продажа: 14289 | Прибыль за шт: -249.4300000000003

--- Полный лог сессии ---
[15:58:44] === Начинается сессия продаж ===
[15:58:44] [DEBUG] Проверка существования purchase_log.csv по пути c:\Users\Student\Documents\GitHub\albion_market_main\purchase_log.csv
[15:58:44] [DEBUG] Загружено 19 строк из purchase_log.csv
[15:58:44] [DEBUG] Журнал покупок успешно обработан, 19 уникальных предметов
[15:58:45] [DEBUG] Загружено 391 строк из table.xlsx
[15:58:45] [DEBUG] Колонки table.xlsx: ['name', 'value', 'tir', 'store', 'present']
[15:58:45] [DEBUG] OCR распознал предмет: 'колпак ученого (мастер)'
[15:58:45] [DEBUG] Найдено 0 в purchase_log, 1 в table.xlsx
[15:58:45] [DEBUG] колпак ученого (мастер) не найден в purchase_log, используем table.xlsx
[15:58:45] [DEBUG] Кликаем sell_button для колпак ученого (мастер)
[15:58:46] [DEBUG] Кликаем minus_button для колпак ученого (мастер)
[15:58:47] [DEBUG] Распознана цена продажи: 87395
[15:58:47] [DEBUG] Распознана цена продажи за предмет: 18999
[15:58:47] [DEBUG] Количество предметов в стеке: 5
[15:58:47] [DEBUG] Профит за 1 предмет: -6787.895
[15:58:47] [DEBUG] Кликаем confirm_button для колпак ученого (мастер)
[15:58:47] [DEBUG] Продажа подтверждена: доход=87395, прибыль за шт=-6787.895
[15:58:47] [DEBUG] Итерация завершена, failure_counter=0
[15:58:48] [DEBUG] OCR распознал предмет: 'броня солдата (знаток)'
[15:58:48] [DEBUG] Найдено 1 в purchase_log, 1 в table.xlsx
[15:58:48] [DEBUG] WAPP для броня солдата (знаток): 2965.0
[15:58:48] [DEBUG] Кликаем sell_button для броня солдата (знаток)
[15:58:48] [DEBUG] Кликаем minus_button для броня солдата (знаток)
[15:58:49] [DEBUG] Распознана цена продажи: 19748
[15:58:50] [DEBUG] Распознана цена продажи за предмет: 5099
[15:58:50] [DEBUG] Количество предметов в стеке: 4
[15:58:50] [DEBUG] Профит за 1 предмет: 1598.6050000000005
[15:58:50] [DEBUG] Кликаем confirm_button для броня солдата (знаток)
[15:58:50] [DEBUG] Продажа подтверждена: доход=107143, прибыль за шт=1598.6050000000005
[15:58:50] [DEBUG] Итерация завершена, failure_counter=0
[15:58:51] [DEBUG] OCR распознал предмет: 'капюшон наемника (знаток)'
[15:58:51] [DEBUG] Найдено 0 в purchase_log, 1 в table.xlsx
[15:58:51] [DEBUG] капюшон наемника (знаток) не найден в purchase_log, используем table.xlsx
[15:58:51] [DEBUG] Кликаем sell_button для капюшон наемника (знаток)
[15:58:51] [DEBUG] Кликаем minus_button для капюшон наемника (знаток)
[15:58:52] [DEBUG] Распознана цена продажи: 3571
[15:58:53] [DEBUG] Распознана цена продажи за предмет: 3882
[15:58:53] [DEBUG] Количество предметов в стеке: 1
[15:58:53] [DEBUG] Профит за 1 предмет: 13.389999999999873
[15:58:53] [DEBUG] Кликаем confirm_button для капюшон наемника (знаток)
[15:58:53] [DEBUG] Продажа подтверждена: доход=110714, прибыль за шт=13.389999999999873
[15:58:53] [DEBUG] Итерация завершена, failure_counter=0
[15:58:53] [DEBUG] OCR распознал предмет: 'капюшон убийцы (знаток)'
[15:58:53] [DEBUG] Найдено 1 в purchase_log, 1 в table.xlsx
[15:58:53] [DEBUG] WAPP для капюшон убийцы (знаток): 1896.0
[15:58:53] [DEBUG] Кликаем sell_button для капюшон убийцы (знаток)
[15:58:54] [DEBUG] Кликаем minus_button для капюшон убийцы (знаток)
[15:58:55] [DEBUG] Распознана цена продажи: 6341
[15:58:55] [DEBUG] Распознана цена продажи за предмет: 3446
[15:58:55] [DEBUG] Количество предметов в стеке: 2
[15:58:55] [DEBUG] Профит за 1 предмет: 1188.17
[15:58:55] [DEBUG] Кликаем confirm_button для капюшон убийцы (знаток)
[15:58:55] [DEBUG] Продажа подтверждена: доход=117055, прибыль за шт=1188.17
[15:58:56] [DEBUG] Итерация завершена, failure_counter=0
[15:58:56] [DEBUG] OCR распознал предмет: 'мантия клирика (мастер)'
[15:58:56] [DEBUG] Найдено 1 в purchase_log, 1 в table.xlsx
[15:58:56] [DEBUG] WAPP для мантия клирика (мастер): 39091.0
[15:58:56] [DEBUG] Кликаем sell_button для мантия клирика (мастер)
[15:58:57] [DEBUG] Кликаем minus_button для мантия клирика (мастер)
[15:58:57] [DEBUG] Распознана цена продажи: 359661
[15:58:58] [DEBUG] Распознана цена продажи за предмет: 48867
[15:58:58] [DEBUG] Количество предметов в стеке: 8
[15:58:58] [DEBUG] Профит за 1 предмет: 4644.965000000004
[15:58:58] [DEBUG] Кликаем confirm_button для мантия клирика (мастер)
[15:58:58] [DEBUG] Продажа подтверждена: доход=476716, прибыль за шт=4644.965000000004
[15:58:58] [DEBUG] Итерация завершена, failure_counter=0
[15:58:59] [DEBUG] OCR распознал предмет: 'мантия ученого (знаток)'
[15:58:59] [DEBUG] Найдено 1 в purchase_log, 1 в table.xlsx
[15:58:59] [DEBUG] WAPP для мантия ученого (знаток): 3478.0
[15:58:59] [DEBUG] Кликаем sell_button для мантия ученого (знаток)
[15:58:59] [DEBUG] Кликаем minus_button для мантия ученого (знаток)
[15:59:00] [DEBUG] Распознана цена продажи: 29054
[15:59:01] [DEBUG] Распознана цена продажи за предмет: 6316
[15:59:01] [DEBUG] Количество предметов в стеке: 5
[15:59:01] [DEBUG] Профит за 1 предмет: 2174.8199999999997
[15:59:01] [DEBUG] Кликаем confirm_button для мантия ученого (знаток)
[15:59:01] [DEBUG] Продажа подтверждена: доход=505770, прибыль за шт=2174.8199999999997
[15:59:01] [DEBUG] Итерация завершена, failure_counter=0
[15:59:01] [DEBUG] OCR распознал предмет: 'капюшон убийцы (мастер)'
[15:59:01] [DEBUG] Найдено 1 в purchase_log, 1 в table.xlsx
[15:59:01] [DEBUG] WAPP для капюшон убийцы (мастер): 27903.0
[15:59:01] [DEBUG] Кликаем sell_button для капюшон убийцы (мастер)
[15:59:02] [DEBUG] Кликаем minus_button для капюшон убийцы (мастер)
[15:59:03] [DEBUG] Распознана цена продажи: 224589
[15:59:03] [DEBUG] Распознана цена продажи за предмет: 34874
[15:59:03] [DEBUG] Количество предметов в стеке: 7
[15:59:03] [DEBUG] Профит за 1 предмет: 3309.2299999999996
[15:59:03] [DEBUG] Кликаем confirm_button для капюшон убийцы (мастер)
[15:59:03] [DEBUG] Продажа подтверждена: доход=730359, прибыль за шт=3309.2299999999996
[15:59:03] [DEBUG] Итерация завершена, failure_counter=0
[15:59:04] [DEBUG] OCR распознал предмет: 'куртка убийцы (эксперт)'
[15:59:04] [DEBUG] Найдено 1 в purchase_log, 1 в table.xlsx
[15:59:04] [DEBUG] WAPP для куртка убийцы (эксперт): 10484.0
[15:59:04] [DEBUG] Кликаем sell_button для куртка убийцы (эксперт)
[15:59:04] [DEBUG] Кликаем minus_button для куртка убийцы (эксперт)
[15:59:06] [DEBUG] Распознана цена продажи: 166483
[15:59:07] [DEBUG] Распознана цена продажи за предмет: 15080
[15:59:07] [DEBUG] Количество предметов в стеке: 12
[15:59:07] [DEBUG] Профит за 1 предмет: 3012.6000000000004
[15:59:07] [DEBUG] Кликаем confirm_button для куртка убийцы (эксперт)
[15:59:07] [DEBUG] Продажа подтверждена: доход=896842, прибыль за шт=3012.6000000000004
[15:59:07] [DEBUG] Итерация завершена, failure_counter=0
[15:59:07] [DEBUG] OCR распознал предмет: 'капюшон убийцы (мастер)'
[15:59:07] [DEBUG] Найдено 1 в purchase_log, 1 в table.xlsx
[15:59:07] [DEBUG] WAPP для капюшон убийцы (мастер): 27903.0
[15:59:07] [DEBUG] Кликаем sell_button для капюшон убийцы (мастер)
[15:59:08] [DEBUG] Кликаем minus_button для капюшон убийцы (мастер)
[15:59:09] [DEBUG] Распознана цена продажи: 192510
[15:59:09] [DEBUG] Распознана цена продажи за предмет: 34875
[15:59:09] [DEBUG] Количество предметов в стеке: 6
[15:59:09] [DEBUG] Профит за 1 предмет: 3310.125
[15:59:09] [DEBUG] Кликаем confirm_button для капюшон убийцы (мастер)
[15:59:09] [DEBUG] Продажа подтверждена: доход=1089352, прибыль за шт=3310.125
[15:59:09] [DEBUG] Итерация завершена, failure_counter=0
[15:59:10] [DEBUG] OCR распознал предмет: 'броня солдата (знаток)'
[15:59:10] [DEBUG] Найдено 1 в purchase_log, 1 в table.xlsx
[15:59:10] [DEBUG] WAPP для броня солдата (знаток): 2965.0
[15:59:10] [DEBUG] Кликаем sell_button для броня солдата (знаток)
[15:59:10] [DEBUG] Кликаем minus_button для броня солдата (знаток)
[15:59:11] [DEBUG] Распознана цена продажи: 42228
[15:59:12] [DEBUG] Распознана цена продажи за предмет: 5098
[15:59:12] [DEBUG] Количество предметов в стеке: 9
[15:59:12] [DEBUG] Профит за 1 предмет: 1597.71
[15:59:12] [DEBUG] Кликаем confirm_button для броня солдата (знаток)
[15:59:12] [DEBUG] Продажа подтверждена: доход=1131580, прибыль за шт=1597.71
[15:59:12] [DEBUG] Итерация завершена, failure_counter=0
[15:59:13] [DEBUG] OCR распознал предмет: 'шлем солдата (эксперт)'
[15:59:13] [DEBUG] Найдено 1 в purchase_log, 1 в table.xlsx
[15:59:13] [DEBUG] WAPP для шлем солдата (эксперт): 4807.0
[15:59:13] [DEBUG] Кликаем sell_button для шлем солдата (эксперт)
[15:59:13] [DEBUG] Кликаем minus_button для шлем солдата (эксперт)
[15:59:14] [DEBUG] Распознана цена продажи: 6320
[15:59:15] [DEBUG] Распознана цена продажи за предмет: 6870
[15:59:15] [DEBUG] Количество предметов в стеке: 1
[15:59:15] [DEBUG] Профит за 1 предмет: 1341.6500000000005
[15:59:15] [DEBUG] Кликаем confirm_button для шлем солдата (эксперт)
[15:59:15] [DEBUG] Продажа подтверждена: доход=1137900, прибыль за шт=1341.6500000000005
[15:59:15] [DEBUG] Итерация завершена, failure_counter=0
[15:59:16] [DEBUG] OCR распознал предмет: 'колпак чародея (мастер)'
[15:59:16] [DEBUG] Найдено 0 в purchase_log, 1 в table.xlsx
[15:59:16] [DEBUG] колпак чародея (мастер) не найден в purchase_log, используем table.xlsx
[15:59:16] [DEBUG] Кликаем sell_button для колпак чародея (мастер)
[15:59:16] [DEBUG] Кликаем minus_button для колпак чародея (мастер)
[15:59:17] [DEBUG] Распознана цена продажи: 22988
[15:59:18] [DEBUG] Распознана цена продажи за предмет: 24987
[15:59:18] [DEBUG] Количество предметов в стеке: 1
[15:59:18] [DEBUG] Профит за 1 предмет: -1974.6349999999984
[15:59:18] [DEBUG] Кликаем confirm_button для колпак чародея (мастер)
[15:59:18] [DEBUG] Продажа подтверждена: доход=1160888, прибыль за шт=-1974.6349999999984
[15:59:18] [DEBUG] Итерация завершена, failure_counter=0
[15:59:18] [DEBUG] OCR распознал предмет: 'капюшон наемника (знаток)'
[15:59:18] [DEBUG] Найдено 0 в purchase_log, 1 в table.xlsx
[15:59:18] [DEBUG] капюшон наемника (знаток) не найден в purchase_log, используем table.xlsx
[15:59:18] [DEBUG] Кликаем sell_button для капюшон наемника (знаток)
[15:59:19] [DEBUG] Кликаем minus_button для капюшон наемника (знаток)
[15:59:20] [DEBUG] Распознана цена продажи: 16086
[15:59:20] [DEBUG] Распознана цена продажи за предмет: 3497
[15:59:20] [DEBUG] Количество предметов в стеке: 5
[15:59:20] [DEBUG] Профит за 1 предмет: -331.18499999999995
[15:59:20] [DEBUG] Кликаем confirm_button для капюшон наемника (знаток)
[15:59:20] [DEBUG] Продажа подтверждена: доход=1176974, прибыль за шт=-331.18499999999995
[15:59:20] [DEBUG] Итерация завершена, failure_counter=0
[15:59:21] [DEBUG] OCR распознал предмет: 'колпак клирика (знаток)'
[15:59:21] [DEBUG] Найдено 1 в purchase_log, 1 в table.xlsx
[15:59:21] [DEBUG] WAPP для колпак клирика (знаток): 1447.0
[15:59:21] [DEBUG] Кликаем sell_button для колпак клирика (знаток)
[15:59:21] [DEBUG] Кликаем minus_button для колпак клирика (знаток)
[15:59:22] [DEBUG] Распознана цена продажи: 60421
[15:59:23] [DEBUG] Распознана цена продажи за предмет: 2627
[15:59:23] [DEBUG] Количество предметов в стеке: 25
[15:59:23] [DEBUG] Профит за 1 предмет: 904.165
[15:59:23] [DEBUG] Кликаем confirm_button для колпак клирика (знаток)
[15:59:23] [DEBUG] Продажа подтверждена: доход=1237395, прибыль за шт=904.165
[15:59:23] [DEBUG] Итерация завершена, failure_counter=0
[15:59:24] [DEBUG] OCR распознал предмет: 'шлем хранителя (мастер)'
[15:59:24] [DEBUG] Найдено 1 в purchase_log, 1 в table.xlsx
[15:59:24] [DEBUG] WAPP для шлем хранителя (мастер): 17758.0
[15:59:24] [DEBUG] Кликаем sell_button для шлем хранителя (мастер)
[15:59:24] [DEBUG] Кликаем minus_button для шлем хранителя (мастер)
[15:59:25] [DEBUG] Распознана цена продажи: 187807
[15:59:26] [DEBUG] Распознана цена продажи за предмет: 22682
[15:59:26] [DEBUG] Количество предметов в стеке: 9
[15:59:26] [DEBUG] Профит за 1 предмет: 2542.3899999999994
[15:59:26] [DEBUG] Кликаем confirm_button для шлем хранителя (мастер)
[15:59:26] [DEBUG] Продажа подтверждена: доход=1425202, прибыль за шт=2542.3899999999994
[15:59:26] [DEBUG] Итерация завершена, failure_counter=0
[15:59:27] [DEBUG] OCR распознал предмет: 'шлем рыцаря (мастер)'
[15:59:27] [DEBUG] Найдено 1 в purchase_log, 1 в table.xlsx
[15:59:27] [DEBUG] WAPP для шлем рыцаря (мастер): 17199.0
[15:59:27] [DEBUG] Кликаем sell_button для шлем рыцаря (мастер)
[15:59:27] [DEBUG] Кликаем minus_button для шлем рыцаря (мастер)
[15:59:28] [DEBUG] Распознана цена продажи: 80839
[15:59:29] [DEBUG] Распознана цена продажи за предмет: 21967
[15:59:29] [DEBUG] Количество предметов в стеке: 4
[15:59:29] [DEBUG] Профит за 1 предмет: 2461.465
[15:59:29] [DEBUG] Кликаем confirm_button для шлем рыцаря (мастер)
[15:59:29] [DEBUG] Продажа подтверждена: доход=1506041, прибыль за шт=2461.465
[15:59:29] [DEBUG] Итерация завершена, failure_counter=0
[15:59:30] [DEBUG] OCR распознал предмет: 'броня хранителя (эксперт)'
[15:59:30] [DEBUG] Найдено 1 в purchase_log, 1 в table.xlsx
[15:59:30] [DEBUG] WAPP для броня хранителя (эксперт): 9441.0
[15:59:30] [DEBUG] Кликаем sell_button для броня хранителя (эксперт)
[15:59:30] [DEBUG] Кликаем minus_button для броня хранителя (эксперт)
[15:59:31] [DEBUG] Распознана цена продажи: 114007
[15:59:32] [DEBUG] Распознана цена продажи за предмет: 13769
[15:59:32] [DEBUG] Количество предметов в стеке: 9
[15:59:32] [DEBUG] Профит за 1 предмет: 2882.255000000001
[15:59:32] [DEBUG] Кликаем confirm_button для броня хранителя (эксперт)
[15:59:32] [DEBUG] Продажа подтверждена: доход=1620048, прибыль за шт=2882.255000000001
[15:59:32] [DEBUG] Итерация завершена, failure_counter=0
[15:59:33] [DEBUG] OCR распознал предмет: 'броня солдата (эксперт)'
[15:59:33] [DEBUG] Найдено 0 в purchase_log, 1 в table.xlsx
[15:59:33] [DEBUG] броня солдата (эксперт) не найден в purchase_log, используем table.xlsx
[15:59:33] [DEBUG] Кликаем sell_button для броня солдата (эксперт)
[15:59:33] [DEBUG] Кликаем minus_button для броня солдата (эксперт)
[15:59:35] [DEBUG] Распознана цена продажи: 13158
[15:59:35] [DEBUG] Распознана цена продажи за предмет: 14302
[15:59:35] [DEBUG] Количество предметов в стеке: 1
[15:59:35] [DEBUG] Профит за 1 предмет: -1198.7099999999991
[15:59:35] [DEBUG] Кликаем confirm_button для броня солдата (эксперт)
[15:59:35] [DEBUG] Продажа подтверждена: доход=1633206, прибыль за шт=-1198.7099999999991
[15:59:35] [DEBUG] Итерация завершена, failure_counter=0
[15:59:36] [DEBUG] OCR распознал предмет: 'капюшон убийцы (знаток)'
[15:59:36] [DEBUG] Найдено 1 в purchase_log, 1 в table.xlsx
[15:59:36] [DEBUG] WAPP для капюшон убийцы (знаток): 1896.0
[15:59:36] [DEBUG] Кликаем sell_button для капюшон убийцы (знаток)
[15:59:37] [DEBUG] Кликаем minus_button для капюшон убийцы (знаток)
[15:59:37] [DEBUG] Распознана цена продажи: 294840
[15:59:38] [DEBUG] Распознана цена продажи за предмет: 3445
[15:59:38] [DEBUG] Количество предметов в стеке: 95
[15:59:38] [DEBUG] Профит за 1 предмет: 1187.275
[15:59:38] [DEBUG] Кликаем confirm_button для капюшон убийцы (знаток)
[15:59:38] [DEBUG] Продажа подтверждена: доход=1928046, прибыль за шт=1187.275
[15:59:38] [DEBUG] Итерация завершена, failure_counter=0
[15:59:39] [DEBUG] OCR распознал предмет: 'броня солдата (эксперт)'
[15:59:39] [DEBUG] Найдено 0 в purchase_log, 1 в table.xlsx
[15:59:39] [DEBUG] броня солдата (эксперт) не найден в purchase_log, используем table.xlsx
[15:59:39] [DEBUG] Кликаем sell_button для броня солдата (эксперт)
[15:59:39] [DEBUG] Кликаем minus_button для броня солдата (эксперт)
[15:59:40] [DEBUG] Распознана цена продажи: 13619
[15:59:41] [DEBUG] Распознана цена продажи за предмет: 14803
[15:59:41] [DEBUG] Количество предметов в стеке: 1
[15:59:41] [DEBUG] Профит за 1 предмет: -750.3150000000005
[15:59:41] [DEBUG] Кликаем confirm_button для броня солдата (эксперт)
[15:59:41] [DEBUG] Продажа подтверждена: доход=1941665, прибыль за шт=-750.3150000000005
[15:59:41] [DEBUG] Итерация завершена, failure_counter=0
[15:59:42] [DEBUG] OCR распознал предмет: 'куртка убийцы (эксперт)'
[15:59:42] [DEBUG] Найдено 1 в purchase_log, 1 в table.xlsx
[15:59:42] [DEBUG] WAPP для куртка убийцы (эксперт): 10484.0
[15:59:42] [DEBUG] Кликаем sell_button для куртка убийцы (эксперт)
[15:59:42] [DEBUG] Кликаем minus_button для куртка убийцы (эксперт)
[15:59:43] [DEBUG] Распознана цена продажи: 83242
[15:59:44] [DEBUG] Распознана цена продажи за предмет: 15079
[15:59:44] [DEBUG] Количество предметов в стеке: 6
[15:59:44] [DEBUG] Профит за 1 предмет: 3011.705
[15:59:44] [DEBUG] Кликаем confirm_button для куртка убийцы (эксперт)
[15:59:44] [DEBUG] Продажа подтверждена: доход=2024907, прибыль за шт=3011.705
[15:59:44] [DEBUG] Итерация завершена, failure_counter=0
[15:59:45] [DEBUG] OCR распознал предмет: 'куртка охотника (эксперт)'
[15:59:45] [DEBUG] Найдено 0 в purchase_log, 1 в table.xlsx
[15:59:45] [DEBUG] куртка охотника (эксперт) не найден в purchase_log, используем table.xlsx
[15:59:45] [DEBUG] Кликаем sell_button для куртка охотника (эксперт)
[15:59:45] [DEBUG] Кликаем minus_button для куртка охотника (эксперт)
[15:59:46] [DEBUG] Распознана цена продажи: 61445
[15:59:47] [DEBUG] Распознана цена продажи за предмет: 16697
[15:59:47] [DEBUG] Количество предметов в стеке: 4
[15:59:47] [DEBUG] Профит за 1 предмет: -1853.1849999999995
[15:59:47] [DEBUG] Кликаем confirm_button для куртка охотника (эксперт)
[15:59:47] [DEBUG] Продажа подтверждена: доход=2086352, прибыль за шт=-1853.1849999999995
[15:59:47] [DEBUG] Итерация завершена, failure_counter=0
[15:59:48] [DEBUG] OCR распознал предмет: 'куртка наемника (мастер)'
[15:59:48] [DEBUG] Найдено 0 в purchase_log, 1 в table.xlsx
[15:59:48] [DEBUG] куртка наемника (мастер) не найден в purchase_log, используем table.xlsx
[15:59:48] [DEBUG] Кликаем sell_button для куртка наемника (мастер)
[15:59:48] [DEBUG] Кликаем minus_button для куртка наемника (мастер)
[15:59:49] [DEBUG] Распознана цена продажи: 30598
[15:59:50] [DEBUG] Распознана цена продажи за предмет: 54998
[15:59:50] [DEBUG] Количество предметов в стеке: 0
[15:59:50] [DEBUG] Профит за 1 предмет: -5619.790000000001
[15:59:50] [DEBUG] Кликаем confirm_button для куртка наемника (мастер)
[15:59:50] [DEBUG] Продажа подтверждена: доход=2116950, прибыль за шт=-5619.790000000001
[15:59:50] [DEBUG] Итерация завершена, failure_counter=0
[15:59:50] [DEBUG] OCR распознал предмет: 'капюшон убийцы (мастер)'
[15:59:50] [DEBUG] Найдено 1 в purchase_log, 1 в table.xlsx
[15:59:50] [DEBUG] WAPP для капюшон убийцы (мастер): 27903.0
[15:59:50] [DEBUG] Кликаем sell_button для капюшон убийцы (мастер)
[15:59:51] [DEBUG] Кликаем minus_button для капюшон убийцы (мастер)
[15:59:52] [DEBUG] Распознана цена продажи: 96261
[15:59:53] [DEBUG] Распознана цена продажи за предмет: 34877
[15:59:53] [DEBUG] Количество предметов в стеке: 3
[15:59:53] [DEBUG] Профит за 1 предмет: 3311.915000000001
[15:59:53] [DEBUG] Кликаем confirm_button для капюшон убийцы (мастер)
[15:59:53] [DEBUG] Продажа подтверждена: доход=2213211, прибыль за шт=3311.915000000001
[15:59:53] [DEBUG] Итерация завершена, failure_counter=0
[15:59:53] [DEBUG] OCR распознал предмет: 'мантия чародея (знаток)'
[15:59:53] [DEBUG] Найдено 1 в purchase_log, 1 в table.xlsx
[15:59:53] [DEBUG] WAPP для мантия чародея (знаток): 2789.0
[15:59:53] [DEBUG] Кликаем sell_button для мантия чародея (знаток)
[15:59:54] [DEBUG] Кликаем minus_button для мантия чародея (знаток)
[15:59:55] [DEBUG] Распознана цена продажи: 23322
[15:59:56] [DEBUG] Распознана цена продажи за предмет: 5070
[15:59:56] [DEBUG] Количество предметов в стеке: 5
[15:59:56] [DEBUG] Профит за 1 предмет: 1748.6499999999996
[15:59:56] [DEBUG] Кликаем confirm_button для мантия чародея (знаток)
[15:59:56] [DEBUG] Продажа подтверждена: доход=2236533, прибыль за шт=1748.6499999999996
[15:59:56] [DEBUG] Итерация завершена, failure_counter=0
[15:59:56] [DEBUG] OCR распознал предмет: 'куртка охотника (эксперт)'
[15:59:56] [DEBUG] Найдено 0 в purchase_log, 1 в table.xlsx
[15:59:56] [DEBUG] куртка охотника (эксперт) не найден в purchase_log, используем table.xlsx
[15:59:56] [DEBUG] Кликаем sell_button для куртка охотника (эксперт)
[15:59:57] [DEBUG] Кликаем minus_button для куртка охотника (эксперт)
[15:59:58] [DEBUG] Распознана цена продажи: 15361
[15:59:59] [DEBUG] Распознана цена продажи за предмет: 16696
[15:59:59] [DEBUG] Количество предметов в стеке: 1
[15:59:59] [DEBUG] Профит за 1 предмет: -1854.08
[15:59:59] [DEBUG] Кликаем confirm_button для куртка охотника (эксперт)
[15:59:59] [DEBUG] Продажа подтверждена: доход=2251894, прибыль за шт=-1854.08
[15:59:59] [DEBUG] Итерация завершена, failure_counter=0
[15:59:59] [DEBUG] OCR распознал предмет: 'колпак чародея (эксперт)'
[15:59:59] [DEBUG] Найдено 1 в purchase_log, 1 в table.xlsx
[15:59:59] [DEBUG] WAPP для колпак чародея (эксперт): 5236.0
[15:59:59] [DEBUG] Кликаем sell_button для колпак чародея (эксперт)
[16:00:00] [DEBUG] Кликаем minus_button для колпак чародея (эксперт)
[16:00:02] [DEBUG] Распознана цена продажи: 123885
[16:00:03] [DEBUG] Распознана цена продажи за предмет: 7481
[16:00:03] [DEBUG] Количество предметов в стеке: 18
[16:00:03] [DEBUG] Профит за 1 предмет: 1459.495
[16:00:03] [DEBUG] Кликаем confirm_button для колпак чародея (эксперт)
[16:00:03] [DEBUG] Продажа подтверждена: доход=2375779, прибыль за шт=1459.495
[16:00:03] [DEBUG] Итерация завершена, failure_counter=0
[16:00:07] [DEBUG] OCR распознал предмет: 'в'
[16:00:07] [DEBUG] Найдено 0 в purchase_log, 0 в table.xlsx
[16:00:07] [DEBUG] в отсутствует и в purchase_log, и в table.xlsx, попытка 1
[16:00:09] [DEBUG] OCR распознал предмет: 'в'
[16:00:09] [DEBUG] Найдено 0 в purchase_log, 0 в table.xlsx
[16:00:09] [DEBUG] в отсутствует и в purchase_log, и в table.xlsx, попытка 2
[16:00:10] [DEBUG] OCR распознал предмет: 'колпак чародея (эксперт)'
[16:00:10] [DEBUG] Найдено 1 в purchase_log, 1 в table.xlsx
[16:00:10] [DEBUG] WAPP для колпак чародея (эксперт): 5236.0
[16:00:10] [DEBUG] Кликаем sell_button для колпак чародея (эксперт)
[16:00:10] [DEBUG] Кликаем minus_button для колпак чародея (эксперт)
[16:00:11] [DEBUG] Распознана цена продажи: 123885
[16:00:12] [DEBUG] Распознана цена продажи за предмет: 7481
[16:00:12] [DEBUG] Количество предметов в стеке: 18
[16:00:12] [DEBUG] Профит за 1 предмет: 1459.495
[16:00:12] [DEBUG] Кликаем confirm_button для колпак чародея (эксперт)
[16:00:12] [DEBUG] Продажа подтверждена: доход=2499664, прибыль за шт=1459.495
[16:00:12] [DEBUG] Итерация завершена, failure_counter=0
[16:00:13] [DEBUG] OCR распознал предмет: 'мантия клирика (мастер)'
[16:00:13] [DEBUG] Найдено 1 в purchase_log, 1 в table.xlsx
[16:00:13] [DEBUG] WAPP для мантия клирика (мастер): 39091.0
[16:00:13] [DEBUG] Кликаем sell_button для мантия клирика (мастер)
[16:00:13] [DEBUG] Кликаем minus_button для мантия клирика (мастер)
[16:00:15] [DEBUG] Распознана цена продажи: 494575
[16:00:16] [DEBUG] Распознана цена продажи за предмет: 48871
[16:00:16] [DEBUG] Количество предметов в стеке: 11
[16:00:16] [DEBUG] Профит за 1 предмет: 4648.544999999998
[16:00:16] [DEBUG] Кликаем confirm_button для мантия клирика (мастер)
[16:00:16] [DEBUG] Продажа подтверждена: доход=2994239, прибыль за шт=4648.544999999998
[16:00:16] [DEBUG] Итерация завершена, failure_counter=0
[16:00:16] [DEBUG] OCR распознал предмет: 'броня солдата (эксперт)'
[16:00:16] [DEBUG] Найдено 0 в purchase_log, 1 в table.xlsx
[16:00:16] [DEBUG] броня солдата (эксперт) не найден в purchase_log, используем table.xlsx
[16:00:16] [DEBUG] Кликаем sell_button для броня солдата (эксперт)
[16:00:17] [DEBUG] Кликаем minus_button для броня солдата (эксперт)
[16:00:18] [DEBUG] Распознана цена продажи: 13159
[16:00:19] [DEBUG] Распознана цена продажи за предмет: 14303
[16:00:19] [DEBUG] Количество предметов в стеке: 1
[16:00:19] [DEBUG] Профит за 1 предмет: -1197.8150000000005
[16:00:19] [DEBUG] Кликаем confirm_button для броня солдата (эксперт)
[16:00:19] [DEBUG] Продажа подтверждена: доход=3007398, прибыль за шт=-1197.8150000000005
[16:00:19] [DEBUG] Итерация завершена, failure_counter=0
[16:00:19] [DEBUG] OCR распознал предмет: 'броня солдата (эксперт)'
[16:00:19] [DEBUG] Найдено 0 в purchase_log, 1 в table.xlsx
[16:00:19] [DEBUG] броня солдата (эксперт) не найден в purchase_log, используем table.xlsx
[16:00:19] [DEBUG] Кликаем sell_button для броня солдата (эксперт)
[16:00:20] [DEBUG] Кликаем minus_button для броня солдата (эксперт)
[16:00:21] [DEBUG] Распознана цена продажи: 0
[16:00:22] [DEBUG] Распознана цена продажи за предмет: -1
[16:00:22] [DEBUG] Цена продажи не распознана, пропуск предмета броня солдата (эксперт)
[16:00:22] [DEBUG] Итерация завершена, failure_counter=0
[16:00:23] [DEBUG] OCR распознал предмет: 'шлем рыцаря (мастер)'
[16:00:23] [DEBUG] Найдено 1 в purchase_log, 1 в table.xlsx
[16:00:23] [DEBUG] WAPP для шлем рыцаря (мастер): 17199.0
[16:00:23] [DEBUG] Кликаем sell_button для шлем рыцаря (мастер)
[16:00:24] [DEBUG] Кликаем minus_button для шлем рыцаря (мастер)
[16:00:25] [DEBUG] Распознана цена продажи: 161640
[16:00:26] [DEBUG] Распознана цена продажи за предмет: 21962
[16:00:26] [DEBUG] Количество предметов в стеке: 8
[16:00:26] [DEBUG] Профит за 1 предмет: 2456.9900000000016
[16:00:26] [DEBUG] Кликаем confirm_button для шлем рыцаря (мастер)
[16:00:26] [DEBUG] Продажа подтверждена: доход=3169038, прибыль за шт=2456.9900000000016
[16:00:26] [DEBUG] Итерация завершена, failure_counter=0
[16:00:26] [DEBUG] OCR распознал предмет: 'шлем рыцаря (старейшина)'
[16:00:26] [DEBUG] Найдено 1 в purchase_log, 1 в table.xlsx
[16:00:26] [DEBUG] WAPP для шлем рыцаря (старейшина): 101555.0
[16:00:26] [DEBUG] Кликаем sell_button для шлем рыцаря (старейшина)
[16:00:27] [DEBUG] Кликаем minus_button для шлем рыцаря (старейшина)
[16:00:28] [DEBUG] Распознана цена продажи: 244711
[16:00:29] [DEBUG] Распознана цена продажи за предмет: 132995
[16:00:29] [DEBUG] Количество предметов в стеке: 2
[16:00:29] [DEBUG] Профит за 1 предмет: 17475.52500000001
[16:00:29] [DEBUG] Кликаем confirm_button для шлем рыцаря (старейшина)
[16:00:29] [DEBUG] Продажа подтверждена: доход=3413749, прибыль за шт=17475.52500000001
[16:00:29] [DEBUG] Итерация завершена, failure_counter=0
[16:00:29] [DEBUG] OCR распознал предмет: 'капюшон наемника (эксперт)'
[16:00:29] [DEBUG] Найдено 0 в purchase_log, 1 в table.xlsx
[16:00:29] [DEBUG] капюшон наемника (эксперт) не найден в purchase_log, используем table.xlsx
[16:00:29] [DEBUG] Кликаем sell_button для капюшон наемника (эксперт)
[16:00:30] [DEBUG] Кликаем minus_button для капюшон наемника (эксперт)
[16:00:31] [DEBUG] Распознана цена продажи: 33113
[16:00:32] [DEBUG] Распознана цена продажи за предмет: 8998
[16:00:32] [DEBUG] Количество предметов в стеке: 4
[16:00:32] [DEBUG] Профит за 1 предмет: 67.21000000000004
[16:00:32] [DEBUG] Кликаем confirm_button для капюшон наемника (эксперт)
[16:00:32] [DEBUG] Продажа подтверждена: доход=3446862, прибыль за шт=67.21000000000004
[16:00:32] [DEBUG] Итерация завершена, failure_counter=0
[16:00:33] [DEBUG] OCR распознал предмет: 'капюшон наемника (эксперт)'
[16:00:33] [DEBUG] Найдено 0 в purchase_log, 1 в table.xlsx
[16:00:33] [DEBUG] капюшон наемника (эксперт) не найден в purchase_log, используем table.xlsx
[16:00:33] [DEBUG] Кликаем sell_button для капюшон наемника (эксперт)
[16:00:33] [DEBUG] Кликаем minus_button для капюшон наемника (эксперт)
[16:00:34] [DEBUG] Распознана цена продажи: 8277
[16:00:35] [DEBUG] Распознана цена продажи за предмет: 8997
[16:00:35] [DEBUG] Количество предметов в стеке: 1
[16:00:35] [DEBUG] Профит за 1 предмет: 66.31500000000051
[16:00:35] [DEBUG] Кликаем confirm_button для капюшон наемника (эксперт)
[16:00:35] [DEBUG] Продажа подтверждена: доход=3455139, прибыль за шт=66.31500000000051
[16:00:35] [DEBUG] Итерация завершена, failure_counter=0
[16:00:36] [DEBUG] OCR распознал предмет: 'шлем хранителя (знаток)'
[16:00:36] [DEBUG] Найдено 0 в purchase_log, 1 в table.xlsx
[16:00:36] [DEBUG] шлем хранителя (знаток) не найден в purchase_log, используем table.xlsx
[16:00:36] [DEBUG] Кликаем sell_button для шлем хранителя (знаток)
[16:00:36] [DEBUG] Кликаем minus_button для шлем хранителя (знаток)
[16:00:37] [DEBUG] Распознана цена продажи: 2202
[16:00:38] [DEBUG] Распознана цена продажи за предмет: 2393
[16:00:38] [DEBUG] Количество предметов в стеке: 1
[16:00:38] [DEBUG] Профит за 1 предмет: -247.26499999999987
[16:00:38] [DEBUG] Кликаем confirm_button для шлем хранителя (знаток)
[16:00:38] [DEBUG] Продажа подтверждена: доход=3457341, прибыль за шт=-247.26499999999987
[16:00:38] [DEBUG] Итерация завершена, failure_counter=0
[16:00:39] [DEBUG] OCR распознал предмет: 'шлем хранителя (мастер)'
[16:00:39] [DEBUG] Найдено 1 в purchase_log, 1 в table.xlsx
[16:00:39] [DEBUG] WAPP для шлем хранителя (мастер): 17758.0
[16:00:39] [DEBUG] Кликаем sell_button для шлем хранителя (мастер)
[16:00:39] [DEBUG] Кликаем minus_button для шлем хранителя (мастер)
[16:00:40] [DEBUG] Распознана цена продажи: 229542
[16:00:41] [DEBUG] Распознана цена продажи за предмет: 22682
[16:00:41] [DEBUG] Количество предметов в стеке: 11
[16:00:41] [DEBUG] Профит за 1 предмет: 2542.3899999999994
[16:00:41] [DEBUG] Кликаем confirm_button для шлем хранителя (мастер)
[16:00:41] [DEBUG] Продажа подтверждена: доход=3686883, прибыль за шт=2542.3899999999994
[16:00:41] [DEBUG] Итерация завершена, failure_counter=0
[16:00:42] [DEBUG] OCR распознал предмет: 'шлем рыцаря (мастер)'
[16:00:42] [DEBUG] Найдено 1 в purchase_log, 1 в table.xlsx
[16:00:42] [DEBUG] WAPP для шлем рыцаря (мастер): 17199.0
[16:00:42] [DEBUG] Кликаем sell_button для шлем рыцаря (мастер)
[16:00:42] [DEBUG] Кликаем minus_button для шлем рыцаря (мастер)
[16:00:43] [DEBUG] Распознана цена продажи: 909475
[16:00:44] [DEBUG] Распознана цена продажи за предмет: 21968
[16:00:44] [DEBUG] Количество предметов в стеке: 46
[16:00:44] [DEBUG] Профит за 1 предмет: 2462.3600000000006
[16:00:44] [DEBUG] Кликаем confirm_button для шлем рыцаря (мастер)
[16:00:44] [DEBUG] Продажа подтверждена: доход=4596358, прибыль за шт=2462.3600000000006
[16:00:44] [DEBUG] Итерация завершена, failure_counter=0
[16:00:45] [DEBUG] OCR распознал предмет: 'куртка охотника (знаток)'
[16:00:45] [DEBUG] Найдено 1 в purchase_log, 1 в table.xlsx
[16:00:45] [DEBUG] WAPP для куртка охотника (знаток): 2906.0
[16:00:45] [DEBUG] Кликаем sell_button для куртка охотника (знаток)
[16:00:46] [DEBUG] Кликаем minus_button для куртка охотника (знаток)
[16:00:47] [DEBUG] Распознана цена продажи: 9715
[16:00:47] [DEBUG] Распознана цена продажи за предмет: 5280
[16:00:47] [DEBUG] Количество предметов в стеке: 2
[16:00:47] [DEBUG] Профит за 1 предмет: 1819.6000000000004
[16:00:48] [DEBUG] Кликаем confirm_button для куртка охотника (знаток)
[16:00:48] [DEBUG] Продажа подтверждена: доход=4606073, прибыль за шт=1819.6000000000004
[16:00:48] [DEBUG] Итерация завершена, failure_counter=0
[16:00:48] [DEBUG] OCR распознал предмет: 'мантия ученого (знаток)'
[16:00:48] [DEBUG] Найдено 1 в purchase_log, 1 в table.xlsx
[16:00:48] [DEBUG] WAPP для мантия ученого (знаток): 3478.0
[16:00:48] [DEBUG] Кликаем sell_button для мантия ученого (знаток)
[16:00:49] [DEBUG] Кликаем minus_button для мантия ученого (знаток)
[16:00:50] [DEBUG] Распознана цена продажи: 63958
[16:00:50] [DEBUG] Распознана цена продажи за предмет: 6320
[16:00:50] [DEBUG] Количество предметов в стеке: 11
[16:00:50] [DEBUG] Профит за 1 предмет: 2178.4000000000005
[16:00:50] [DEBUG] Кликаем confirm_button для мантия ученого (знаток)
[16:00:50] [DEBUG] Продажа подтверждена: доход=4670031, прибыль за шт=2178.4000000000005
[16:00:50] [DEBUG] Итерация завершена, failure_counter=0
[16:00:51] [DEBUG] OCR распознал предмет: 'мантия ученого (знаток)'
[16:00:51] [DEBUG] Найдено 1 в purchase_log, 1 в table.xlsx
[16:00:51] [DEBUG] WAPP для мантия ученого (знаток): 3478.0
[16:00:51] [DEBUG] Кликаем sell_button для мантия ученого (знаток)
[16:00:51] [DEBUG] Кликаем minus_button для мантия ученого (знаток)
[16:00:52] [DEBUG] Распознана цена продажи: 174432
[16:00:53] [DEBUG] Распознана цена продажи за предмет: 6319
[16:00:53] [DEBUG] Количество предметов в стеке: 30
[16:00:53] [DEBUG] Профит за 1 предмет: 2177.505
[16:00:53] [DEBUG] Кликаем confirm_button для мантия ученого (знаток)
[16:00:53] [DEBUG] Продажа подтверждена: доход=4844463, прибыль за шт=2177.505
[16:00:53] [DEBUG] Итерация завершена, failure_counter=0
[16:00:54] [DEBUG] OCR распознал предмет: 'мантия клирика (мастер)'
[16:00:54] [DEBUG] Найдено 1 в purchase_log, 1 в table.xlsx
[16:00:54] [DEBUG] WAPP для мантия клирика (мастер): 39091.0
[16:00:54] [DEBUG] Кликаем sell_button для мантия клирика (мастер)
[16:00:54] [DEBUG] Кликаем minus_button для мантия клирика (мастер)
[16:00:55] [DEBUG] Распознана цена продажи: 256669
[16:00:56] [DEBUG] Распознана цена продажи за предмет: 46498
[16:00:56] [DEBUG] Количество предметов в стеке: 6
[16:00:56] [DEBUG] Профит за 1 предмет: 2524.709999999999
[16:00:56] [DEBUG] Кликаем confirm_button для мантия клирика (мастер)
[16:00:56] [DEBUG] Продажа подтверждена: доход=5101132, прибыль за шт=2524.709999999999
[16:00:56] [DEBUG] Итерация завершена, failure_counter=0
[16:00:57] [DEBUG] OCR распознал предмет: 'мантия клирика (знаток)'
[16:00:57] [DEBUG] Найдено 1 в purchase_log, 1 в table.xlsx
[16:00:57] [DEBUG] WAPP для мантия клирика (знаток): 2460.0
[16:00:57] [DEBUG] Кликаем sell_button для мантия клирика (знаток)
[16:00:57] [DEBUG] Кликаем minus_button для мантия клирика (знаток)
[16:00:58] [DEBUG] Распознана цена продажи: 12323
[16:00:59] [DEBUG] Распознана цена продажи за предмет: 4465
[16:00:59] [DEBUG] Количество предметов в стеке: 3
[16:00:59] [DEBUG] Профит за 1 предмет: 1536.1750000000002
[16:00:59] [DEBUG] Кликаем confirm_button для мантия клирика (знаток)
[16:00:59] [DEBUG] Продажа подтверждена: доход=5113455, прибыль за шт=1536.1750000000002
[16:01:00] [DEBUG] Итерация завершена, failure_counter=0
[16:01:00] [DEBUG] OCR распознал предмет: 'капюшон убийцы (знаток)'
[16:01:00] [DEBUG] Найдено 1 в purchase_log, 1 в table.xlsx
[16:01:00] [DEBUG] WAPP для капюшон убийцы (знаток): 1896.0
[16:01:00] [DEBUG] Кликаем sell_button для капюшон убийцы (знаток)
[16:01:01] [DEBUG] Кликаем minus_button для капюшон убийцы (знаток)
[16:01:02] [DEBUG] Распознана цена продажи: 30725
[16:01:02] [DEBUG] Распознана цена продажи за предмет: 3445
[16:01:02] [DEBUG] Количество предметов в стеке: 9
[16:01:02] [DEBUG] Профит за 1 предмет: 1187.275
[16:01:03] [DEBUG] Кликаем confirm_button для капюшон убийцы (знаток)
[16:01:03] [DEBUG] Продажа подтверждена: доход=5144180, прибыль за шт=1187.275
[16:01:03] [DEBUG] Итерация завершена, failure_counter=0
[16:01:03] [DEBUG] OCR распознал предмет: 'капюшон охотника (знаток)'
[16:01:03] [DEBUG] Найдено 1 в purchase_log, 1 в table.xlsx
[16:01:03] [DEBUG] WAPP для капюшон охотника (знаток): 1870.0
[16:01:03] [DEBUG] Кликаем sell_button для капюшон охотника (знаток)
[16:01:04] [DEBUG] Кликаем minus_button для капюшон охотника (знаток)
[16:01:05] [DEBUG] Распознана цена продажи: 326376
[16:01:05] [DEBUG] Распознана цена продажи за предмет: 3478
[16:01:05] [DEBUG] Количество предметов в стеке: 104
[16:01:05] [DEBUG] Профит за 1 предмет: 1242.81
[16:01:06] [DEBUG] Кликаем confirm_button для капюшон охотника (знаток)
[16:01:06] [DEBUG] Продажа подтверждена: доход=5470556, прибыль за шт=1242.81
[16:01:06] [DEBUG] Итерация завершена, failure_counter=0
[16:01:06] [DEBUG] OCR распознал предмет: 'броня хранителя (эксперт)'
[16:01:06] [DEBUG] Найдено 1 в purchase_log, 1 в table.xlsx
[16:01:06] [DEBUG] WAPP для броня хранителя (эксперт): 9441.0
[16:01:06] [DEBUG] Кликаем sell_button для броня хранителя (эксперт)
[16:01:07] [DEBUG] Кликаем minus_button для броня хранителя (эксперт)
[16:01:08] [DEBUG] Распознана цена продажи: 177345
[16:01:08] [DEBUG] Распознана цена продажи за предмет: 13769
[16:01:08] [DEBUG] Количество предметов в стеке: 14
[16:01:08] [DEBUG] Профит за 1 предмет: 2882.255000000001
[16:01:09] [DEBUG] Кликаем confirm_button для броня хранителя (эксперт)
[16:01:09] [DEBUG] Продажа подтверждена: доход=5647901, прибыль за шт=2882.255000000001
[16:01:09] [DEBUG] Итерация завершена, failure_counter=0
[16:01:09] [DEBUG] OCR распознал предмет: 'капюшон охотника (знаток)'
[16:01:09] [DEBUG] Найдено 1 в purchase_log, 1 в table.xlsx
[16:01:09] [DEBUG] WAPP для капюшон охотника (знаток): 1870.0
[16:01:09] [DEBUG] Кликаем sell_button для капюшон охотника (знаток)
[16:01:10] [DEBUG] Кликаем minus_button для капюшон охотника (знаток)
[16:01:11] [DEBUG] Распознана цена продажи: 6400
[16:01:11] [DEBUG] Распознана цена продажи за предмет: 3477
[16:01:11] [DEBUG] Количество предметов в стеке: 2
[16:01:11] [DEBUG] Профит за 1 предмет: 1241.915
[16:01:12] [DEBUG] Кликаем confirm_button для капюшон охотника (знаток)
[16:01:12] [DEBUG] Продажа подтверждена: доход=5654301, прибыль за шт=1241.915
[16:01:12] [DEBUG] Итерация завершена, failure_counter=0
[16:01:12] [DEBUG] OCR распознал предмет: 'куртка охотника (мастер)'
[16:01:12] [DEBUG] Найдено 1 в purchase_log, 1 в table.xlsx
[16:01:12] [DEBUG] WAPP для куртка охотника (мастер): 41189.0
[16:01:12] [DEBUG] Кликаем sell_button для куртка охотника (мастер)
[16:01:13] [DEBUG] Кликаем minus_button для куртка охотника (мастер)
[16:01:14] [DEBUG] Распознана цена продажи: 806430
[16:01:14] [DEBUG] Распознана цена продажи за предмет: 51562
[16:01:14] [DEBUG] Количество предметов в стеке: 17
[16:01:14] [DEBUG] Профит за 1 предмет: 4958.989999999998
[16:01:14] [DEBUG] Кликаем confirm_button для куртка охотника (мастер)
[16:01:15] [DEBUG] Продажа подтверждена: доход=6460731, прибыль за шт=4958.989999999998
[16:01:15] [DEBUG] Итерация завершена, failure_counter=0
[16:01:15] [DEBUG] OCR распознал предмет: 'мантия клирика (эксперт)'
[16:01:15] [DEBUG] Найдено 1 в purchase_log, 1 в table.xlsx
[16:01:15] [DEBUG] WAPP для мантия клирика (эксперт): 11522.0
[16:01:15] [DEBUG] Кликаем sell_button для мантия клирика (эксперт)
[16:01:16] [DEBUG] Кликаем minus_button для мантия клирика (эксперт)
[16:01:17] [DEBUG] Распознана цена продажи: 45438
[16:01:18] [DEBUG] Распознана цена продажи за предмет: 16463
[16:01:18] [DEBUG] Количество предметов в стеке: 3
[16:01:18] [DEBUG] Профит за 1 предмет: 3212.385
[16:01:18] [DEBUG] Кликаем confirm_button для мантия клирика (эксперт)
[16:01:18] [DEBUG] Продажа подтверждена: доход=6506169, прибыль за шт=3212.385
[16:01:18] [DEBUG] Итерация завершена, failure_counter=0
[16:01:18] [DEBUG] OCR распознал предмет: 'колпак клирика (эксперт)'
[16:01:18] [DEBUG] Найдено 0 в purchase_log, 1 в table.xlsx
[16:01:18] [DEBUG] колпак клирика (эксперт) не найден в purchase_log, используем table.xlsx
[16:01:18] [DEBUG] Кликаем sell_button для колпак клирика (эксперт)
[16:01:19] [DEBUG] Кликаем minus_button для колпак клирика (эксперт)
[16:01:20] [DEBUG] Распознана цена продажи: 14289
[16:01:21] [DEBUG] Распознана цена продажи за предмет: 7766
[16:01:21] [DEBUG] Количество предметов в стеке: 2
[16:01:21] [DEBUG] Профит за 1 предмет: -249.4300000000003
[16:01:21] [DEBUG] Кликаем confirm_button для колпак клирика (эксперт)
[16:01:21] [DEBUG] Продажа подтверждена: доход=6520458, прибыль за шт=-249.4300000000003
[16:01:21] [DEBUG] Итерация завершена, failure_counter=0
[16:01:21] [DEBUG] OCR распознал предмет: '—а'
[16:01:21] [DEBUG] Найдено 0 в purchase_log, 0 в table.xlsx
[16:01:21] [DEBUG] —а отсутствует и в purchase_log, и в table.xlsx, попытка 1
[16:01:23] [DEBUG] OCR распознал предмет: '—а'
[16:01:23] [DEBUG] Найдено 0 в purchase_log, 0 в table.xlsx
[16:01:23] [DEBUG] —а отсутствует и в purchase_log, и в table.xlsx, попытка 2
[16:01:24] [DEBUG] OCR распознал предмет: '—а'
[16:01:24] [DEBUG] Найдено 0 в purchase_log, 0 в table.xlsx
[16:01:24] [DEBUG] —а отсутствует и в purchase_log, и в table.xlsx, попытка 3
[16:01:25] [DEBUG] OCR распознал предмет: '—а'
[16:01:25] [DEBUG] Найдено 0 в purchase_log, 0 в table.xlsx
[16:01:25] [DEBUG] —а отсутствует и в purchase_log, и в table.xlsx, попытка 4
[16:01:27] [DEBUG] OCR распознал предмет: '—а'
[16:01:27] [DEBUG] Найдено 0 в purchase_log, 0 в table.xlsx
[16:01:27] [DEBUG] —а отсутствует и в purchase_log, и в table.xlsx, попытка 5
[16:01:28] [DEBUG] OCR распознал предмет: '—а'
[16:01:28] [DEBUG] Найдено 0 в purchase_log, 0 в table.xlsx
[16:01:28] [DEBUG] —а отсутствует и в purchase_log, и в table.xlsx, попытка 6
[16:01:29] [DEBUG] OCR распознал предмет: '—а'
[16:01:29] [DEBUG] Найдено 0 в purchase_log, 0 в table.xlsx
[16:01:29] [DEBUG] —а отсутствует и в purchase_log, и в table.xlsx, попытка 7
[16:01:31] [DEBUG] OCR распознал предмет: '—а'
[16:01:31] [DEBUG] Найдено 0 в purchase_log, 0 в table.xlsx
[16:01:31] [DEBUG] —а отсутствует и в purchase_log, и в table.xlsx, попытка 8
[16:01:32] [DEBUG] OCR распознал предмет: '—а'
[16:01:32] [DEBUG] Найдено 0 в purchase_log, 0 в table.xlsx
[16:01:32] [DEBUG] —а отсутствует и в purchase_log, и в table.xlsx, попытка 9
[16:01:33] [DEBUG] OCR распознал предмет: '—а'
[16:01:33] [DEBUG] Найдено 0 в purchase_log, 0 в table.xlsx
[16:01:33] [DEBUG] —а отсутствует и в purchase_log, и в table.xlsx, попытка 10
[16:01:35] [DEBUG] OCR распознал предмет: '—а'
[16:01:35] [DEBUG] Найдено 0 в purchase_log, 0 в table.xlsx
[16:01:35] [DEBUG] —а отсутствует и в purchase_log, и в table.xlsx, попытка 11
[16:01:36] [DEBUG] OCR распознал предмет: '—а'
[16:01:36] [DEBUG] Найдено 0 в purchase_log, 0 в table.xlsx
[16:01:36] [DEBUG] —а отсутствует и в purchase_log, и в table.xlsx, попытка 12
[16:01:38] [DEBUG] OCR распознал предмет: '—а'
[16:01:38] [DEBUG] Найдено 0 в purchase_log, 0 в table.xlsx
[16:01:38] [DEBUG] —а отсутствует и в purchase_log, и в table.xlsx, попытка 13
[16:01:39] [DEBUG] OCR распознал предмет: '—а'
[16:01:39] [DEBUG] Найдено 0 в purchase_log, 0 в table.xlsx
[16:01:39] [DEBUG] —а отсутствует и в purchase_log, и в table.xlsx, попытка 14
[16:01:40] [DEBUG] OCR распознал предмет: '—а'
[16:01:40] [DEBUG] Найдено 0 в purchase_log, 0 в table.xlsx
[16:01:40] [DEBUG] —а отсутствует и в purchase_log, и в table.xlsx, попытка 15
[16:01:41] [DEBUG] Сформирован отчет:
--- Итог сессии ---
Доход: 6520458
Расход: 4000000
Прибыль: 2520458
колпак ученого (мастер) x5 | Продажа: 87395 | Прибыль за шт: -6787.895
броня солдата (знаток) x4 | Продажа: 19748 | Прибыль за шт: 1598.6050000000005
капюшон наемника (знаток) x1 | Продажа: 3571 | Прибыль за шт: 13.389999999999873
капюшон убийцы (знаток) x2 | Продажа: 6341 | Прибыль за шт: 1188.17
мантия клирика (мастер) x8 | Продажа: 359661 | Прибыль за шт: 4644.965000000004
мантия ученого (знаток) x5 | Продажа: 29054 | Прибыль за шт: 2174.8199999999997
капюшон убийцы (мастер) x7 | Продажа: 224589 | Прибыль за шт: 3309.2299999999996
куртка убийцы (эксперт) x12 | Продажа: 166483 | Прибыль за шт: 3012.6000000000004
капюшон убийцы (мастер) x6 | Продажа: 192510 | Прибыль за шт: 3310.125
броня солдата (знаток) x9 | Продажа: 42228 | Прибыль за шт: 1597.71
шлем солдата (эксперт) x1 | Продажа: 6320 | Прибыль за шт: 1341.6500000000005
колпак чародея (мастер) x1 | Продажа: 22988 | Прибыль за шт: -1974.6349999999984
капюшон наемника (знаток) x5 | Продажа: 16086 | Прибыль за шт: -331.18499999999995
колпак клирика (знаток) x25 | Продажа: 60421 | Прибыль за шт: 904.165
шлем хранителя (мастер) x9 | Продажа: 187807 | Прибыль за шт: 2542.3899999999994
шлем рыцаря (мастер) x4 | Продажа: 80839 | Прибыль за шт: 2461.465
броня хранителя (эксперт) x9 | Продажа: 114007 | Прибыль за шт: 2882.255000000001
броня солдата (эксперт) x1 | Продажа: 13158 | Прибыль за шт: -1198.7099999999991
капюшон убийцы (знаток) x95 | Продажа: 294840 | Прибыль за шт: 1187.275
броня солдата (эксперт) x1 | Продажа: 13619 | Прибыль за шт: -750.3150000000005
куртка убийцы (эксперт) x6 | Продажа: 83242 | Прибыль за шт: 3011.705
куртка охотника (эксперт) x4 | Продажа: 61445 | Прибыль за шт: -1853.1849999999995
куртка наемника (мастер) x0 | Продажа: 30598 | Прибыль за шт: -5619.790000000001
капюшон убийцы (мастер) x3 | Продажа: 96261 | Прибыль за шт: 3311.915000000001
мантия чародея (знаток) x5 | Продажа: 23322 | Прибыль за шт: 1748.6499999999996
куртка охотника (эксперт) x1 | Продажа: 15361 | Прибыль за шт: -1854.08
колпак чародея (эксперт) x18 | Продажа: 123885 | Прибыль за шт: 1459.495
колпак чародея (эксперт) x18 | Продажа: 123885 | Прибыль за шт: 1459.495
мантия клирика (мастер) x11 | Продажа: 494575 | Прибыль за шт: 4648.544999999998
броня солдата (эксперт) x1 | Продажа: 13159 | Прибыль за шт: -1197.8150000000005
шлем рыцаря (мастер) x8 | Продажа: 161640 | Прибыль за шт: 2456.9900000000016
шлем рыцаря (старейшина) x2 | Продажа: 244711 | Прибыль за шт: 17475.52500000001
капюшон наемника (эксперт) x4 | Продажа: 33113 | Прибыль за шт: 67.21000000000004
капюшон наемника (эксперт) x1 | Продажа: 8277 | Прибыль за шт: 66.31500000000051
шлем хранителя (знаток) x1 | Продажа: 2202 | Прибыль за шт: -247.26499999999987
шлем хранителя (мастер) x11 | Продажа: 229542 | Прибыль за шт: 2542.3899999999994
шлем рыцаря (мастер) x46 | Продажа: 909475 | Прибыль за шт: 2462.3600000000006
куртка охотника (знаток) x2 | Продажа: 9715 | Прибыль за шт: 1819.6000000000004
мантия ученого (знаток) x11 | Продажа: 63958 | Прибыль за шт: 2178.4000000000005
мантия ученого (знаток) x30 | Продажа: 174432 | Прибыль за шт: 2177.505
мантия клирика (мастер) x6 | Продажа: 256669 | Прибыль за шт: 2524.709999999999
мантия клирика (знаток) x3 | Продажа: 12323 | Прибыль за шт: 1536.1750000000002
капюшон убийцы (знаток) x9 | Продажа: 30725 | Прибыль за шт: 1187.275
капюшон охотника (знаток) x104 | Продажа: 326376 | Прибыль за шт: 1242.81
броня хранителя (эксперт) x14 | Продажа: 177345 | Прибыль за шт: 2882.255000000001
капюшон охотника (знаток) x2 | Продажа: 6400 | Прибыль за шт: 1241.915
куртка охотника (мастер) x17 | Продажа: 806430 | Прибыль за шт: 4958.989999999998
мантия клирика (эксперт) x3 | Продажа: 45438 | Прибыль за шт: 3212.385
колпак клирика (эксперт) x2 | Продажа: 14289 | Прибыль за шт: -249.4300000000003